------------------------------------------------------------------------------

    * Giuseppe Barca         * Hamish Brown           * Jorge Galvez-Vallejo
    * Andrew Gilbert         * Min Htoo               * Fazeleh Kazemian    
    * Sean Laguna            * Jack Miller            * Elise Palethorpe    
    * Oliver Pulsford        * Ross Pure              * Christopher Seidl   
    * Dylan Silke            * Joshua Singla          * Calum Snowdon       
    * Ryan Stocks            * Ryan Swart             * Fiona Yu            


                 _..--+~/@-~--.      _____  __  __  _____   ____    ____
             _-=~      (  .   "}    | ____| \ \/ / | ____| / ___|  / ___|
          _-~     _.--=.\ \""""     |  _|    \  /  |  _|   \___ \  \___ \
        _~      _-       \ \_\      | |___   /  \  | |___   ___) |  ___) |
       =      _=          '--'      |_____| /_/\_\ |_____| |____/  |____/
      '      =
     :      :     ____            EXtreme-scale Electronic Structure System
___ |      ;                               Enjoy the power of GPUs!
    ;       ;                            Gordon Bell Award Winner 2024
  ___=       \ ___ __     __..-...__
     :        =_     _.-~~          ~~--.__
_____ \         ~-+-~                   ___~=_______
       == ...______ __ ___ _--~~--_
  

------------------------------------------------------------------------------

Commit no. used aedfa7ed9d5dfb1d6a4530fc669e9d390dc3eedd
Start of Calculation Local time: 2025-10-20 01:36:31
Start of Calculation UTC time:   2025-10-20 08:36:31
├── Calculation params
│   ├── Title: /global/u2/r/ryans/dhdft/inputs/exess/exess_inputs/isomers_31120-31139
│   ├── Driver: Energy
│   ├── Model
│   │   ├── Theory level: KS DFT
│   │   ├── Spin configuration: Restricted
│   │   ├── Primary basis: def2-QZVPP
│   │   ├── Auxiliary basis: def2-QZVPP-RIFIT
│   │   ├── Force cartesian basis sets: False
│   │   ├── Standard orientation: None
│   ├── Topologies
│   │   ├── Number of topologies: 20
│   ├── Keywords
│   │   ├── SCF keywords
│   │   │   ├── Max iterations: 50
│   │   │   ├── Batch size: 2560
│   │   │   ├── DIIS size: 8
│   │   │   ├── Convergence threshold: 1.000e-10
│   │   │   ├── Use guess fallback: False
│   │   │   ├── Convergence metric: DIIS
│   │   │   ├── Density threshold: 1.000e-10
│   │   │   ├── Gradient screening threshold: 1.000e-10
│   │   │   ├── Allow crap scf: False
│   │   │   ├── Fock build type: RI
│   │   │   ├── Group shared exponents: False
│   │   │   ├── Store RI B tensor on host: False
│   │   │   ├── Compress B tensor shell pairs: True
│   │   ├── KS
│   │   │   ├── Functional: REVDSD-PBEP86-D4(NOFC)
│   │   │   ├── Method: BatchDense
│   │   │   ├── Hybrid: True
│   │   │   ├── Grid
│   │   │   │   ├── RadialQuad: MuraKnowles
│   │   │   │   ├── PruningScheme: ROBUST
│   │   │   │   ├── Consider weight zero: 1.000e-15
│   │   │   │   ├── Octree
│   │   │   │   │   ├── Max size: 2048
│   │   │   │   │   ├── Max depth: 18446744073709551615
│   │   │   │   │   ├── Max distance: -2147483648
│   │   │   │   │   ├── Combine small children: Some(1)
│   │   │   │   ├── GridDefaults: ULTRAFINE
│   │   │   ├── Use C optimization: False
│   │   │   ├── Double precision threshold: 1.000e-10
│   │   │   ├── Batches per batch: 30
│   │   ├── RTAT keywords
│   │   │   ├── Enabled: True
│   │   ├── Debug keywords
│   │   │   ├── Dry run: False
│   │   │   ├── Skip calcs: False
│   │   │   ├── Subfragment XYZ debug: False
│   │   ├── Export Keywords
│   │   │   ├── Not exporting any matrices
│   │   ├── Guess keywords
│   │   │   ├── Superposition of monomer densities: False
│   │   │   ├── Superposition of subfragment densities: False
│   │   │   ├── Basis set projection: False
│   │   ├── Boundary keywords
│   │   │   ├── X
│   │   │   │   ├── Type: None
│   │   │   ├── Y
│   │   │   │   ├── Type: None
│   │   │   ├── Z
│   │   │   │   ├── Type: None
│   │   ├── Logging
│   │   │   ├── Restricted logs visible
│   │   │   ├── Console logging
│   │   │   │   ├── Level: INFO
│   │   │   │   ├── Use log level colors: False
│   │   ├── Integrals Keywords
│   │   │   ├── Scheduler: Callback
│   │   │   ├── Number of streams: 4
│   ├── System
│   │   ├── Max GPU Memory: 54 GB
│   │   ├── Oversubscribe GPUs: False
│   │   ├── Teams per node: 1

************************************************************
****** Doing a batched calculation with 20 topologies ******
************************************************************

************************************************************
***************** Running topology 1 of 20 *****************
************************************************************

Created 3051662 / 16064064 significant shell pairs
************************************************************
******** Beginning RI-REVDSD-PBEP86-D4(NOFC) energy ********
************************************************************

Created 2047580 / 10419984 significant shell pairs
Total number of grid points: 686918 (10101 per atom)
Total number of grid points: 687051 (10103 per atom)
Total number of grid points: 686494 (10095 per atom)
Total number of grid points: 687417 (10109 per atom)
Octree generated 448 batches
Octree generated 441 batches
Octree generated 438 batches
Octree generated 443 batches
Creating 438 batches. Average size: 1332, max size: 2046
Batching took 0.355978 seconds (33.52 MB)
Creating 441 batches. Average size: 1327, max size: 2046
Batching took 0.358431 seconds (33.53 MB)
Creating 448 batches. Average size: 1303, max size: 2041
Batching took 0.359509 seconds (34.3 MB)
Creating 443 batches. Average size: 1317, max size: 2047
Batching took 0.356465 seconds (33.8 MB)
One electron integrals and orthogonalizer took 0.585824s
Created 2047580 / 10419984 significant shell pairs
3C integrals and B formation took 13.396762s
Iteration |      Energy      |  DIIS Metric   | Fock Time (s) | DIIS Time (s)
----------+------------------+----------------+---------------+--------------
    1     | -1700.9895881066 |   2.5014e+03   |   16.5200     |    0.2182
    2     | -1684.0756586084 |   4.2285e+00   |    2.4843     |    0.1581
    3     | -1684.7187058364 |   1.0807e+00   |    2.4611     |    0.1615
    4     | -1684.8436140184 |   2.4487e-01   |    2.4518     |    0.1645
    5     | -1684.8770973593 |   4.1833e-02   |    2.4633     |    0.1675
    6     | -1684.8832920835 |   2.1825e-03   |    2.4513     |    0.1704
    7     | -1684.8836340713 |   3.8620e-04   |    2.4559     |    0.1736
    8     | -1684.8837048028 |   3.8842e-05   |    2.4468     |    0.1766
    9     | -1684.8837140662 |   7.6921e-06   |    2.4500     |    0.1776
   10     | -1684.8837154458 |   5.6749e-07   |    2.4564     |    0.1777
   11     | -1684.8837155600 |   1.4797e-07   |    2.4523     |    0.1783
   12     | -1684.8837155883 |   1.4978e-08   |    2.4554     |    0.1766
   13     | -1684.8837155933 |   4.0129e-09   |    2.4522     |    0.1768
   14     | -1684.8837155946 |   7.6772e-10   |    2.4528     |    0.1766
   15     | -1684.8837155949 |   2.2662e-10   |    2.4552     |    0.1768
   16     | -1684.8837155950 |   5.6587e-11   |    2.4540     |    0.1766
=======================================================
         REVDSD-PBEP86-D4(NOFC) Energy Results         
=======================================================
E REVDSD-PBEP86-D4(NOFC): -1684.88371559
Nuclear Repulsion Energy: 4576.39273213
Electronic Energy:        -6183.68713594
XC Energy:                -77.589312
Converged:                1
# of SCF iterations:      16
SCF Time:                 71.109s
************************************************************
***************** Beginning RI-MP2 energy ******************
************************************************************

Created 2047580 / 10419984 significant shell pairs
=======================================================
                 RI-MP2 Energy Results                 
=======================================================
E OS:  -7.02034983174
E SS:  -2.32462522825
E MP2: -9.34497505999
Time:  33.114s

=======================================================
            Individual Calculation Summary             
=======================================================
HF Energy: -1684.8837155949627231
MP2 OS Energy: -4.1974671643944710
MP2 SS Energy: -0.1327361005333103
MP2 Total Energy: -4.3302032649277811
MP2 Corrected Energy: -1689.2139188598905548
=======================================================


Topology 0 time: 127.506747 s, performance: SP: 0 FLOP/s, DP: 32.01 TFLOP/s
JSON file written to: json_logs/global_u2_r_ryans_dhdft_inputs_exess_exess_inputs_isomers_31120-31139_topology_0.json
************************************************************
***************** Running topology 2 of 20 *****************
************************************************************

************************************************************
******** Beginning RI-REVDSD-PBEP86-D4(NOFC) energy ********
************************************************************

Created 3242453 / 16064064 significant shell pairs
Created 2175072 / 10419984 significant shell pairs
Total number of grid points: 686397 (10094 per atom)
Total number of grid points: 686867 (10100 per atom)
Total number of grid points: 687374 (10108 per atom)
Total number of grid points: 687242 (10106 per atom)
Octree generated 445 batches
Octree generated 446 batches
Octree generated 440 batches
Octree generated 447 batches
Creating 445 batches. Average size: 1310, max size: 2048
Batching took 0.366461 seconds (34.67 MB)
Creating 446 batches. Average size: 1306, max size: 2048
Batching took 0.369162 seconds (35.07 MB)
Creating 440 batches. Average size: 1325, max size: 2047
Batching took 0.364915 seconds (34.61 MB)
Creating 447 batches. Average size: 1305, max size: 2048
Batching took 0.370449 seconds (35.04 MB)
One electron integrals and orthogonalizer took 0.217648s
Created 2175072 / 10419984 significant shell pairs
3C integrals and B formation took 10.216300s
Iteration |      Energy      |  DIIS Metric   | Fock Time (s) | DIIS Time (s)
----------+------------------+----------------+---------------+--------------
    1     | -1701.2248090224 |   2.5252e+03   |   13.4558     |    0.1547
    2     | -1684.0352046459 |   4.3150e+00   |    2.5737     |    0.1585
    3     | -1684.7088145445 |   1.0348e+00   |    2.5612     |    0.1616
    4     | -1684.8315380699 |   2.1368e-01   |    2.5480     |    0.1646
    5     | -1684.8605034193 |   4.2235e-02   |    2.5518     |    0.1678
    6     | -1684.8668411739 |   2.2773e-03   |    2.5474     |    0.1709
    7     | -1684.8672109337 |   4.7387e-04   |    2.5514     |    0.1740
    8     | -1684.8672963720 |   6.2966e-05   |    2.5778     |    0.1764
    9     | -1684.8673088856 |   1.3366e-05   |    2.5706     |    0.1763
   10     | -1684.8673110897 |   9.7247e-07   |    2.5496     |    0.1763
   11     | -1684.8673112794 |   2.4122e-07   |    2.5436     |    0.1763
   12     | -1684.8673113289 |   3.1914e-08   |    2.5515     |    0.1763
   13     | -1684.8673113410 |   9.1564e-09   |    2.5544     |    0.1764
   14     | -1684.8673113445 |   1.8900e-09   |    2.5489     |    0.1763
   15     | -1684.8673113452 |   6.0829e-10   |    2.5523     |    0.1763
   16     | -1684.8673113454 |   1.1967e-10   |    2.5458     |    0.1765
   17     | -1684.8673113454 |   2.8474e-11   |    2.5488     |    0.1765
=======================================================
         REVDSD-PBEP86-D4(NOFC) Energy Results         
=======================================================
E REVDSD-PBEP86-D4(NOFC): -1684.86731135
Nuclear Repulsion Energy: 4724.34558797
Electronic Energy:        -6331.6201126
XC Energy:                -77.592787
Converged:                1
# of SCF iterations:      17
SCF Time:                 68.642s
************************************************************
***************** Beginning RI-MP2 energy ******************
************************************************************

Created 2175072 / 10419984 significant shell pairs
=======================================================
                 RI-MP2 Energy Results                 
=======================================================
E OS:  -7.03088184706
E SS:  -2.33268610568
E MP2: -9.36356795274
Time:  33.207s

=======================================================
            Individual Calculation Summary             
=======================================================
HF Energy: -1684.8673113454224222
MP2 OS Energy: -4.2037642563580402
MP2 SS Energy: -0.1331963766341885
MP2 Total Energy: -4.3369606329922288
MP2 Corrected Energy: -1689.2042719784146811
=======================================================


Topology 1 time: 102.640229 s, performance: SP: 0 FLOP/s, DP: 40.89 TFLOP/s
JSON file written to: json_logs/global_u2_r_ryans_dhdft_inputs_exess_exess_inputs_isomers_31120-31139_topology_1.json
************************************************************
***************** Running topology 3 of 20 *****************
************************************************************

************************************************************
******** Beginning RI-REVDSD-PBEP86-D4(NOFC) energy ********
************************************************************

Created 2980228 / 16064064 significant shell pairs
Created 1996228 / 10419984 significant shell pairs
Total number of grid points: 686712 (10098 per atom)
Total number of grid points: 687229 (10106 per atom)
Total number of grid points: 687161 (10105 per atom)
Total number of grid points: 686778 (10099 per atom)
Octree generated 450 batches
Octree generated 444 batches
Octree generated 433 batches
Octree generated 447 batches
Creating 450 batches. Average size: 1304, max size: 2044
Batching took 0.358401 seconds (33.94 MB)
Creating 433 batches. Average size: 1343, max size: 2046
Batching took 0.349057 seconds (32.76 MB)
Creating 444 batches. Average size: 1316, max size: 2026
Batching took 0.354594 seconds (33.56 MB)
Creating 447 batches. Average size: 1308, max size: 2045
Batching took 0.356163 seconds (33.76 MB)
One electron integrals and orthogonalizer took 0.222097s
Created 1996228 / 10419984 significant shell pairs
3C integrals and B formation took 9.032213s
Iteration |      Energy      |  DIIS Metric   | Fock Time (s) | DIIS Time (s)
----------+------------------+----------------+---------------+--------------
    1     | -1701.0877452049 |   2.5046e+03   |   13.3377     |    0.1549
    2     | -1684.0714725254 |   4.2242e+00   |    2.4732     |    0.1588
    3     | -1684.7078914216 |   1.1324e+00   |    2.4622     |    0.1618
    4     | -1684.8390810589 |   2.5010e-01   |    2.4523     |    0.1650
    5     | -1684.8736656177 |   4.0248e-02   |    2.4574     |    0.1681
    6     | -1684.8795886653 |   2.3671e-03   |    2.4483     |    0.1711
    7     | -1684.8799564873 |   3.8633e-04   |    2.4427     |    0.1744
    8     | -1684.8800291036 |   4.4589e-05   |    2.4393     |    0.1766
    9     | -1684.8800390352 |   1.0144e-05   |    2.4516     |    0.1765
   10     | -1684.8800408539 |   7.7385e-07   |    2.4353     |    0.1766
   11     | -1684.8800409996 |   2.0953e-07   |    2.4370     |    0.1766
   12     | -1684.8800410394 |   2.0337e-08   |    2.4377     |    0.1765
   13     | -1684.8800410459 |   6.3186e-09   |    2.4312     |    0.1767
   14     | -1684.8800410478 |   1.1879e-09   |    2.4385     |    0.1766
   15     | -1684.8800410482 |   3.7655e-10   |    2.4413     |    0.1766
   16     | -1684.8800410484 |   8.4476e-11   |    2.4362     |    0.1766
=======================================================
         REVDSD-PBEP86-D4(NOFC) Energy Results         
=======================================================
E REVDSD-PBEP86-D4(NOFC): -1684.88004105
Nuclear Repulsion Energy: 4524.28187542
Electronic Energy:        -6131.57402977
XC Energy:                -77.587887
Converged:                1
# of SCF iterations:      16
SCF Time:                 62.902s
************************************************************
***************** Beginning RI-MP2 energy ******************
************************************************************

Created 1996228 / 10419984 significant shell pairs
=======================================================
                 RI-MP2 Energy Results                 
=======================================================
E OS:  -7.02071035679
E SS:  -2.32410506126
E MP2: -9.34481541805
Time:  32.501s

=======================================================
            Individual Calculation Summary             
=======================================================
HF Energy: -1684.8800410483577252
MP2 OS Energy: -4.1976827223238944
MP2 SS Energy: -0.1327063989978509
MP2 Total Energy: -4.3303891213217449
MP2 Corrected Energy: -1689.2104301696795119
=======================================================


Topology 2 time: 96.148340 s, performance: SP: 0 FLOP/s, DP: 42.37 TFLOP/s
JSON file written to: json_logs/global_u2_r_ryans_dhdft_inputs_exess_exess_inputs_isomers_31120-31139_topology_2.json
************************************************************
***************** Running topology 4 of 20 *****************
************************************************************

************************************************************
******** Beginning RI-REVDSD-PBEP86-D4(NOFC) energy ********
************************************************************

Created 2994598 / 16064064 significant shell pairs
Created 2004139 / 10419984 significant shell pairs
Total number of grid points: 687277 (10107 per atom)
Total number of grid points: 687368 (10108 per atom)
Total number of grid points: 686713 (10098 per atom)
Octree generated 450 batches
Total number of grid points: 686522 (10095 per atom)
Octree generated 437 batches
Octree generated 439 batches
Octree generated 438 batches
Creating 450 batches. Average size: 1299, max size: 2047
Batching took 0.362226 seconds (33.99 MB)
Creating 437 batches. Average size: 1333, max size: 2048
Batching took 0.354186 seconds (33.03 MB)
Creating 439 batches. Average size: 1329, max size: 2041
Batching took 0.366923 seconds (33.45 MB)
Creating 438 batches. Average size: 1336, max size: 2026
Batching took 0.359049 seconds (33.14 MB)
One electron integrals and orthogonalizer took 0.230192s
Created 2004139 / 10419984 significant shell pairs
3C integrals and B formation took 9.285284s
Iteration |      Energy      |  DIIS Metric   | Fock Time (s) | DIIS Time (s)
----------+------------------+----------------+---------------+--------------
    1     | -1700.2833792104 |   2.4632e+03   |   13.2979     |    0.1578
    2     | -1683.9859948834 |   4.7880e+00   |    2.4598     |    0.1613
    3     | -1684.6470272508 |   1.4879e+00   |    2.4547     |    0.1646
    4     | -1684.8227485592 |   2.5744e-01   |    2.4592     |    0.1675
    5     | -1684.8581989248 |   4.1873e-02   |    2.4541     |    0.1709
    6     | -1684.8643148234 |   2.3115e-03   |    2.4566     |    0.1742
    7     | -1684.8646722416 |   4.2999e-04   |    2.4548     |    0.1771
    8     | -1684.8647513392 |   4.3888e-05   |    2.4538     |    0.1786
    9     | -1684.8647621298 |   9.7764e-06   |    2.4527     |    0.1787
   10     | -1684.8647639659 |   7.3804e-07   |    2.4543     |    0.1786
   11     | -1684.8647641038 |   2.3829e-07   |    2.4600     |    0.1786
   12     | -1684.8647641462 |   2.1004e-08   |    2.4555     |    0.1785
   13     | -1684.8647641525 |   6.6171e-09   |    2.4526     |    0.1786
   14     | -1684.8647641545 |   1.1073e-09   |    2.4539     |    0.1785
   15     | -1684.8647641549 |   3.7048e-10   |    2.4571     |    0.1785
   16     | -1684.8647641550 |   7.3152e-11   |    2.4561     |    0.1785
=======================================================
         REVDSD-PBEP86-D4(NOFC) Energy Results         
=======================================================
E REVDSD-PBEP86-D4(NOFC): -1684.86476416
Nuclear Repulsion Energy: 4528.41183491
Electronic Energy:        -6135.68844551
XC Energy:                -77.588154
Converged:                1
# of SCF iterations:      16
SCF Time:                 63.337s
************************************************************
***************** Beginning RI-MP2 energy ******************
************************************************************

Created 2004139 / 10419984 significant shell pairs
=======================================================
                 RI-MP2 Energy Results                 
=======================================================
E OS:  -7.02510867147
E SS:  -2.32717522281
E MP2: -9.35228389428
Time:  32.379s

=======================================================
            Individual Calculation Summary             
=======================================================
HF Energy: -1684.8647641550312528
MP2 OS Energy: -4.2003124746721863
MP2 SS Energy: -0.1328817052223824
MP2 Total Energy: -4.3331941798945683
MP2 Corrected Energy: -1689.1979583349257155
=======================================================


Topology 3 time: 96.458453 s, performance: SP: 0 FLOP/s, DP: 42.29 TFLOP/s
JSON file written to: json_logs/global_u2_r_ryans_dhdft_inputs_exess_exess_inputs_isomers_31120-31139_topology_3.json
************************************************************
***************** Running topology 5 of 20 *****************
************************************************************

************************************************************
******** Beginning RI-REVDSD-PBEP86-D4(NOFC) energy ********
************************************************************

Created 3114163 / 16064064 significant shell pairs
Created 2085618 / 10419984 significant shell pairs
Total number of grid points: 687510 (10110 per atom)
Total number of grid points: 686019 (10088 per atom)
Total number of grid points: 688023 (10117 per atom)
Total number of grid points: 686328 (10093 per atom)
Octree generated 449 batches
Octree generated 448 batches
Octree generated 443 batches
Octree generated 440 batches
Creating 449 batches. Average size: 1306, max size: 2045
Batching took 0.372368 seconds (34.47 MB)
Creating 448 batches. Average size: 1308, max size: 2044
Batching took 0.369987 seconds (34.29 MB)
Creating 440 batches. Average size: 1318, max size: 2039
Batching took 0.363093 seconds (33.74 MB)
Creating 443 batches. Average size: 1317, max size: 2047
Batching took 0.364634 seconds (33.96 MB)
One electron integrals and orthogonalizer took 0.232644s
Created 2085618 / 10419984 significant shell pairs
3C integrals and B formation took 10.342382s
Iteration |      Energy      |  DIIS Metric   | Fock Time (s) | DIIS Time (s)
----------+------------------+----------------+---------------+--------------
    1     | -1700.8133773729 |   2.4958e+03   |   13.3900     |    0.1539
    2     | -1683.9598975241 |   4.6974e+00   |    2.5484     |    0.1575
    3     | -1684.6599781156 |   1.2602e+00   |    2.5264     |    0.1606
    4     | -1684.8157719455 |   2.1463e-01   |    2.5207     |    0.1637
    5     | -1684.8456598512 |   4.5880e-02   |    2.5226     |    0.1669
    6     | -1684.8524186059 |   2.3225e-03   |    2.5256     |    0.1700
    7     | -1684.8528028916 |   5.5973e-04   |    2.5229     |    0.1731
    8     | -1684.8529007265 |   6.5543e-05   |    2.5222     |    0.1762
    9     | -1684.8529135402 |   1.3516e-05   |    2.5245     |    0.1762
   10     | -1684.8529157163 |   8.5196e-07   |    2.5171     |    0.1763
   11     | -1684.8529158569 |   2.1075e-07   |    2.5287     |    0.1763
   12     | -1684.8529158925 |   1.6422e-08   |    2.5222     |    0.1761
   13     | -1684.8529158976 |   4.9328e-09   |    2.5221     |    0.1763
   14     | -1684.8529158991 |   9.6823e-10   |    2.5245     |    0.1763
   15     | -1684.8529158994 |   2.5493e-10   |    2.5288     |    0.1761
   16     | -1684.8529158995 |   5.7470e-11   |    2.5227     |    0.1762
=======================================================
         REVDSD-PBEP86-D4(NOFC) Energy Results         
=======================================================
E REVDSD-PBEP86-D4(NOFC): -1684.8529159
Nuclear Repulsion Energy: 4634.5584785
Electronic Energy:        -6241.81929622
XC Energy:                -77.592098
Converged:                1
# of SCF iterations:      16
SCF Time:                 65.477s
************************************************************
***************** Beginning RI-MP2 energy ******************
************************************************************

Created 2085618 / 10419984 significant shell pairs
=======================================================
                 RI-MP2 Energy Results                 
=======================================================
E OS:  -7.03055096775
E SS:  -2.33228198085
E MP2: -9.3628329486
Time:  32.638s

=======================================================
            Individual Calculation Summary             
=======================================================
HF Energy: -1684.8529158994879253
MP2 OS Energy: -4.2035664236190131
MP2 SS Energy: -0.1331733011064369
MP2 Total Energy: -4.3367397247254500
MP2 Corrected Energy: -1689.1896556242134011
=======================================================


Topology 4 time: 98.884909 s, performance: SP: 0 FLOP/s, DP: 41.41 TFLOP/s
JSON file written to: json_logs/global_u2_r_ryans_dhdft_inputs_exess_exess_inputs_isomers_31120-31139_topology_4.json
************************************************************
***************** Running topology 6 of 20 *****************
************************************************************

************************************************************
******** Beginning RI-REVDSD-PBEP86-D4(NOFC) energy ********
************************************************************

Created 3063253 / 16064064 significant shell pairs
Created 2047588 / 10419984 significant shell pairs
Total number of grid points: 687646 (10112 per atom)
Total number of grid points: 686437 (10094 per atom)
Total number of grid points: 686425 (10094 per atom)
Total number of grid points: 687372 (10108 per atom)
Octree generated 436 batches
Octree generated 439 batches
Octree generated 443 batches
Octree generated 452 batches
Creating 436 batches. Average size: 1341, max size: 2048
Batching took 0.356095 seconds (33.42 MB)
Creating 439 batches. Average size: 1325, max size: 2043
Batching took 0.356370 seconds (33.61 MB)
Creating 443 batches. Average size: 1318, max size: 2047
Batching took 0.355796 seconds (33.77 MB)
Creating 452 batches. Average size: 1298, max size: 2042
Batching took 0.366432 seconds (34.35 MB)
One electron integrals and orthogonalizer took 0.226884s
Created 2047588 / 10419984 significant shell pairs
3C integrals and B formation took 10.164790s
Iteration |      Energy      |  DIIS Metric   | Fock Time (s) | DIIS Time (s)
----------+------------------+----------------+---------------+--------------
    1     | -1700.6030624775 |   2.4875e+03   |   13.3821     |    0.1560
    2     | -1683.9626397250 |   4.7608e+00   |    2.4933     |    0.1598
    3     | -1684.6689306565 |   1.2330e+00   |    2.4933     |    0.1630
    4     | -1684.8222064492 |   2.1159e-01   |    2.4965     |    0.1659
    5     | -1684.8511819784 |   4.6205e-02   |    2.5005     |    0.1690
    6     | -1684.8579628197 |   2.7385e-03   |    2.4962     |    0.1721
    7     | -1684.8583761733 |   7.1875e-04   |    2.5004     |    0.1752
    8     | -1684.8584973780 |   5.4565e-05   |    2.4969     |    0.1783
    9     | -1684.8585098535 |   1.2571e-05   |    2.4959     |    0.1783
   10     | -1684.8585119902 |   8.1747e-07   |    2.4995     |    0.1782
   11     | -1684.8585121440 |   2.0971e-07   |    2.4988     |    0.1785
   12     | -1684.8585121841 |   1.7110e-08   |    2.4973     |    0.1784
   13     | -1684.8585121919 |   4.6339e-09   |    2.4993     |    0.1783
   14     | -1684.8585121940 |   1.0008e-09   |    2.4961     |    0.1783
   15     | -1684.8585121944 |   2.6723e-10   |    2.4949     |    0.1785
   16     | -1684.8585121945 |   6.3743e-11   |    2.4932     |    0.1783
=======================================================
         REVDSD-PBEP86-D4(NOFC) Energy Results         
=======================================================
E REVDSD-PBEP86-D4(NOFC): -1684.85851219
Nuclear Repulsion Energy: 4578.0097863
Electronic Energy:        -6185.27714507
XC Energy:                -77.591153
Converged:                1
# of SCF iterations:      16
SCF Time:                 64.904s
************************************************************
***************** Beginning RI-MP2 energy ******************
************************************************************

Created 2047588 / 10419984 significant shell pairs
=======================================================
                 RI-MP2 Energy Results                 
=======================================================
E OS:  -7.02936848591
E SS:  -2.33063174435
E MP2: -9.36000023026
Time:  32.655s

=======================================================
            Individual Calculation Summary             
=======================================================
HF Energy: -1684.8585121945479841
MP2 OS Energy: -4.2028594177235341
MP2 SS Energy: -0.1330790726025937
MP2 Total Energy: -4.3359384903261278
MP2 Corrected Energy: -1689.1944506848740275
=======================================================


Topology 5 time: 98.334519 s, performance: SP: 0 FLOP/s, DP: 41.47 TFLOP/s
JSON file written to: json_logs/global_u2_r_ryans_dhdft_inputs_exess_exess_inputs_isomers_31120-31139_topology_5.json
************************************************************
***************** Running topology 7 of 20 *****************
************************************************************

************************************************************
******** Beginning RI-REVDSD-PBEP86-D4(NOFC) energy ********
************************************************************

Created 3087535 / 16064064 significant shell pairs
Created 2065275 / 10419984 significant shell pairs
Total number of grid points: 686067 (10089 per atom)
Total number of grid points: 687512 (10110 per atom)
Total number of grid points: 686895 (10101 per atom)
Total number of grid points: 687406 (10108 per atom)
Octree generated 438 batches
Octree generated 454 batches
Octree generated 454 batches
Octree generated 450 batches
Creating 438 batches. Average size: 1333, max size: 2046
Batching took 0.360371 seconds (33.42 MB)
Creating 454 batches. Average size: 1292, max size: 2048
Batching took 0.370110 seconds (34.71 MB)
Creating 454 batches. Average size: 1283, max size: 2047
Batching took 0.369518 seconds (34.65 MB)
Creating 450 batches. Average size: 1297, max size: 2047
Batching took 0.364901 seconds (34.38 MB)
One electron integrals and orthogonalizer took 0.226761s
Created 2065275 / 10419984 significant shell pairs
3C integrals and B formation took 10.233039s
Iteration |      Energy      |  DIIS Metric   | Fock Time (s) | DIIS Time (s)
----------+------------------+----------------+---------------+--------------
    1     | -1700.7085486426 |   2.4934e+03   |   13.3831     |    0.1561
    2     | -1683.9764542920 |   4.6439e+00   |    2.5431     |    0.1596
    3     | -1684.6697753684 |   1.2045e+00   |    2.5222     |    0.1628
    4     | -1684.8175576536 |   2.0581e-01   |    2.5150     |    0.1658
    5     | -1684.8458611305 |   3.7948e-02   |    2.5271     |    0.1691
    6     | -1684.8514209686 |   1.9629e-03   |    2.5219     |    0.1724
    7     | -1684.8517264159 |   6.1159e-04   |    2.5114     |    0.1754
    8     | -1684.8518281345 |   4.9429e-05   |    2.5138     |    0.1784
    9     | -1684.8518400444 |   9.7277e-06   |    2.5152     |    0.1786
   10     | -1684.8518417081 |   6.8501e-07   |    2.5086     |    0.1785
   11     | -1684.8518418335 |   2.4471e-07   |    2.5143     |    0.1783
   12     | -1684.8518418763 |   2.0625e-08   |    2.5186     |    0.1785
   13     | -1684.8518418835 |   6.1444e-09   |    2.5140     |    0.1785
   14     | -1684.8518418854 |   1.2927e-09   |    2.5125     |    0.1786
   15     | -1684.8518418858 |   2.9817e-10   |    2.5155     |    0.1785
   16     | -1684.8518418859 |   5.6720e-11   |    2.5138     |    0.1785
=======================================================
         REVDSD-PBEP86-D4(NOFC) Energy Results         
=======================================================
E REVDSD-PBEP86-D4(NOFC): -1684.85184189
Nuclear Repulsion Energy: 4607.91494269
Electronic Energy:        -6215.17623422
XC Energy:                -77.590550
Converged:                1
# of SCF iterations:      16
SCF Time:                 65.313s
************************************************************
***************** Beginning RI-MP2 energy ******************
************************************************************

Created 2065275 / 10419984 significant shell pairs
=======================================================
                 RI-MP2 Energy Results                 
=======================================================
E OS:  -7.03240094204
E SS:  -2.33243788316
E MP2: -9.3648388252
Time:  32.544s

=======================================================
            Individual Calculation Summary             
=======================================================
HF Energy: -1684.8518418858784571
MP2 OS Energy: -4.2046725232452085
MP2 SS Energy: -0.1331822031285198
MP2 Total Energy: -4.3378547263737284
MP2 Corrected Energy: -1689.1896966122521917
=======================================================


Topology 6 time: 98.623015 s, performance: SP: 0 FLOP/s, DP: 41.49 TFLOP/s
JSON file written to: json_logs/global_u2_r_ryans_dhdft_inputs_exess_exess_inputs_isomers_31120-31139_topology_6.json
************************************************************
***************** Running topology 8 of 20 *****************
************************************************************

************************************************************
******** Beginning RI-REVDSD-PBEP86-D4(NOFC) energy ********
************************************************************

Created 3080999 / 16064064 significant shell pairs
Created 2062270 / 10419984 significant shell pairs
Total number of grid points: 686864 (10100 per atom)
Total number of grid points: 687583 (10111 per atom)
Total number of grid points: 686092 (10089 per atom)
Total number of grid points: 687341 (10107 per atom)
Octree generated 443 batches
Octree generated 446 batches
Octree generated 449 batches
Octree generated 447 batches
Creating 443 batches. Average size: 1318, max size: 2048
Batching took 0.363688 seconds (33.69 MB)
Creating 446 batches. Average size: 1316, max size: 2043
Batching took 0.370890 seconds (34 MB)
Creating 449 batches. Average size: 1296, max size: 2043
Batching took 0.374727 seconds (34.29 MB)
Creating 447 batches. Average size: 1310, max size: 2048
Batching took 0.371334 seconds (34.01 MB)
One electron integrals and orthogonalizer took 0.246597s
Created 2062270 / 10419984 significant shell pairs
3C integrals and B formation took 10.210941s
Iteration |      Energy      |  DIIS Metric   | Fock Time (s) | DIIS Time (s)
----------+------------------+----------------+---------------+--------------
    1     | -1700.7413215153 |   2.5084e+03   |   13.3594     |    0.1543
    2     | -1684.0202538885 |   4.4560e+00   |    2.5057     |    0.1579
    3     | -1684.6714344854 |   1.2253e+00   |    2.5097     |    0.1610
    4     | -1684.8168068225 |   2.4759e-01   |    2.5057     |    0.1640
    5     | -1684.8504443180 |   4.5167e-02   |    2.5079     |    0.1673
    6     | -1684.8570042767 |   2.5314e-03   |    2.5164     |    0.1706
    7     | -1684.8573891059 |   4.4143e-04   |    2.5114     |    0.1736
    8     | -1684.8574676275 |   4.3608e-05   |    2.5085     |    0.1767
    9     | -1684.8574771613 |   1.1795e-05   |    2.5105     |    0.1766
   10     | -1684.8574791687 |   1.1092e-06   |    2.5109     |    0.1767
   11     | -1684.8574793511 |   2.5742e-07   |    2.5092     |    0.1768
   12     | -1684.8574793959 |   2.4753e-08   |    2.5025     |    0.1767
   13     | -1684.8574794021 |   8.2140e-09   |    2.5051     |    0.1767
   14     | -1684.8574794044 |   1.5131e-09   |    2.5035     |    0.1766
   15     | -1684.8574794048 |   4.2998e-10   |    2.5062     |    0.1767
   16     | -1684.8574794050 |   1.1277e-10   |    2.5043     |    0.1766
   17     | -1684.8574794050 |   2.9964e-11   |    2.5070     |    0.1767
=======================================================
         REVDSD-PBEP86-D4(NOFC) Energy Results         
=======================================================
E REVDSD-PBEP86-D4(NOFC): -1684.85747941
Nuclear Repulsion Energy: 4608.79589003
Electronic Energy:        -6216.06249937
XC Energy:                -77.590870
Converged:                1
# of SCF iterations:      17
SCF Time:                 67.793s
************************************************************
***************** Beginning RI-MP2 energy ******************
************************************************************

Created 2062270 / 10419984 significant shell pairs
=======================================================
                 RI-MP2 Energy Results                 
=======================================================
E OS:  -7.03118961968
E SS:  -2.33215201587
E MP2: -9.36334163555
Time:  32.613s

=======================================================
            Individual Calculation Summary             
=======================================================
HF Energy: -1684.8574794050025503
MP2 OS Energy: -4.2039482736057812
MP2 SS Energy: -0.1331658801061163
MP2 Total Energy: -4.3371141537118971
MP2 Corrected Energy: -1689.1945935587143595
=======================================================


Topology 7 time: 101.177639 s, performance: SP: 0 FLOP/s, DP: 40.99 TFLOP/s
JSON file written to: json_logs/global_u2_r_ryans_dhdft_inputs_exess_exess_inputs_isomers_31120-31139_topology_7.json
************************************************************
***************** Running topology 9 of 20 *****************
************************************************************

************************************************************
******** Beginning RI-REVDSD-PBEP86-D4(NOFC) energy ********
************************************************************

Created 3032030 / 16064064 significant shell pairs
Created 2027880 / 10419984 significant shell pairs
Total number of grid points: 686741 (10099 per atom)
Total number of grid points: 687240 (10106 per atom)
Total number of grid points: 686648 (10097 per atom)
Total number of grid points: 687251 (10106 per atom)
Octree generated 452 batches
Octree generated 455 batches
Octree generated 447 batches
Octree generated 442 batches
Creating 452 batches. Average size: 1296, max size: 2036
Batching took 0.362963 seconds (34.16 MB)
Creating 447 batches. Average size: 1311, max size: 2036
Batching took 0.363228 seconds (33.96 MB)
Creating 442 batches. Average size: 1319, max size: 2042
Batching took 0.359385 seconds (33.72 MB)
Creating 455 batches. Average size: 1283, max size: 2038
Batching took 0.375091 seconds (34.53 MB)
One electron integrals and orthogonalizer took 0.243009s
Created 2027880 / 10419984 significant shell pairs
3C integrals and B formation took 9.929922s
Iteration |      Energy      |  DIIS Metric   | Fock Time (s) | DIIS Time (s)
----------+------------------+----------------+---------------+--------------
    1     | -1703.0823561450 |   2.5994e+03   |   13.3388     |    0.1540
    2     | -1683.9698318304 |   4.3837e+00   |    2.5000     |    0.1578
    3     | -1684.6399493169 |   1.4003e+00   |    2.4758     |    0.1608
    4     | -1684.8072470562 |   2.6680e-01   |    2.4766     |    0.1639
    5     | -1684.8454359778 |   4.3991e-02   |    2.4865     |    0.1671
    6     | -1684.8521509808 |   2.4525e-03   |    2.4754     |    0.1703
    7     | -1684.8525821660 |   6.7521e-04   |    2.4751     |    0.1733
    8     | -1684.8526955352 |   7.5978e-05   |    2.4760     |    0.1765
    9     | -1684.8527089413 |   1.5116e-05   |    2.4742     |    0.1765
   10     | -1684.8527113548 |   1.2619e-06   |    2.4751     |    0.1765
   11     | -1684.8527115745 |   2.2596e-07   |    2.4776     |    0.1765
   12     | -1684.8527116236 |   3.2593e-08   |    2.4915     |    0.1766
   13     | -1684.8527116349 |   8.6453e-09   |    2.4811     |    0.1766
   14     | -1684.8527116377 |   1.8375e-09   |    2.4908     |    0.1765
   15     | -1684.8527116382 |   4.6844e-10   |    2.4783     |    0.1765
   16     | -1684.8527116383 |   9.6113e-11   |    2.4749     |    0.1765
=======================================================
         REVDSD-PBEP86-D4(NOFC) Energy Results         
=======================================================
E REVDSD-PBEP86-D4(NOFC): -1684.85271164
Nuclear Repulsion Energy: 4557.32560205
Electronic Energy:        -6164.58833385
XC Energy:                -77.589980
Converged:                1
# of SCF iterations:      16
SCF Time:                 64.354s
************************************************************
***************** Beginning RI-MP2 energy ******************
************************************************************

Created 2027880 / 10419984 significant shell pairs
=======================================================
                 RI-MP2 Energy Results                 
=======================================================
E OS:  -7.02983061835
E SS:  -2.33107761672
E MP2: -9.36090823507
Time:  32.684s

=======================================================
            Individual Calculation Summary             
=======================================================
HF Energy: -1684.8527116383402245
MP2 OS Energy: -4.2031357267121319
MP2 SS Energy: -0.1331045319146898
MP2 Total Energy: -4.3362402586268214
MP2 Corrected Energy: -1689.1889518969669552
=======================================================


Topology 8 time: 97.804627 s, performance: SP: 0 FLOP/s, DP: 41.65 TFLOP/s
JSON file written to: json_logs/global_u2_r_ryans_dhdft_inputs_exess_exess_inputs_isomers_31120-31139_topology_8.json
************************************************************
**************** Running topology 10 of 20 *****************
************************************************************

************************************************************
******** Beginning RI-REVDSD-PBEP86-D4(NOFC) energy ********
************************************************************

Created 3102577 / 16064064 significant shell pairs
Created 2078334 / 10419984 significant shell pairs
Total number of grid points: 686319 (10092 per atom)
Total number of grid points: 687444 (10109 per atom)
Total number of grid points: 686529 (10096 per atom)
Total number of grid points: 687588 (10111 per atom)
Octree generated 443 batches
Octree generated 441 batches
Octree generated 451 batches
Octree generated 446 batches
Creating 441 batches. Average size: 1329, max size: 2047
Batching took 0.357717 seconds (33.87 MB)
Creating 443 batches. Average size: 1322, max size: 2047
Batching took 0.359435 seconds (33.54 MB)
Creating 446 batches. Average size: 1308, max size: 2042
Batching took 0.361261 seconds (34.06 MB)
Creating 451 batches. Average size: 1296, max size: 2044
Batching took 0.364029 seconds (34.63 MB)
One electron integrals and orthogonalizer took 0.239280s
Created 2078334 / 10419984 significant shell pairs
3C integrals and B formation took 10.623423s
Iteration |      Energy      |  DIIS Metric   | Fock Time (s) | DIIS Time (s)
----------+------------------+----------------+---------------+--------------
    1     | -1701.3297599994 |   2.5255e+03   |   13.3630     |    0.1540
    2     | -1684.0032452844 |   4.3882e+00   |    2.5015     |    0.1577
    3     | -1684.6686744480 |   1.2108e+00   |    2.5114     |    0.1608
    4     | -1684.8125689158 |   2.7619e-01   |    2.5052     |    0.1641
    5     | -1684.8504586202 |   5.7120e-02   |    2.5048     |    0.1671
    6     | -1684.8589170960 |   3.4505e-03   |    2.5039     |    0.1703
    7     | -1684.8594547908 |   7.0019e-04   |    2.5015     |    0.1734
    8     | -1684.8595787670 |   7.7327e-05   |    2.5002     |    0.1767
    9     | -1684.8595939793 |   2.0430e-05   |    2.5035     |    0.1766
   10     | -1684.8595974358 |   1.3116e-06   |    2.5014     |    0.1766
   11     | -1684.8595976853 |   2.5902e-07   |    2.5015     |    0.1766
   12     | -1684.8595977426 |   4.6099e-08   |    2.5027     |    0.1766
   13     | -1684.8595977570 |   1.3300e-08   |    2.5059     |    0.1766
   14     | -1684.8595977619 |   3.0855e-09   |    2.5159     |    0.1766
   15     | -1684.8595977632 |   8.5753e-10   |    2.5018     |    0.1766
   16     | -1684.8595977634 |   2.2453e-10   |    2.5063     |    0.1766
   17     | -1684.8595977635 |   5.9642e-11   |    2.5047     |    0.1766
=======================================================
         REVDSD-PBEP86-D4(NOFC) Energy Results         
=======================================================
E REVDSD-PBEP86-D4(NOFC): -1684.85959776
Nuclear Repulsion Energy: 4632.6113288
Electronic Energy:        -6239.87881829
XC Energy:                -77.592108
Converged:                1
# of SCF iterations:      17
SCF Time:                 68.128s
************************************************************
***************** Beginning RI-MP2 energy ******************
************************************************************

Created 2078334 / 10419984 significant shell pairs
=======================================================
                 RI-MP2 Energy Results                 
=======================================================
E OS:  -7.02917580107
E SS:  -2.33196874105
E MP2: -9.36114454211
Time:  32.674s

=======================================================
            Individual Calculation Summary             
=======================================================
HF Energy: -1684.8595977635209238
MP2 OS Energy: -4.2027442114575972
MP2 SS Energy: -0.1331554151137015
MP2 Total Energy: -4.3358996265712983
MP2 Corrected Energy: -1689.1954973900922141
=======================================================


Topology 9 time: 101.576992 s, performance: SP: 0 FLOP/s, DP: 40.82 TFLOP/s
JSON file written to: json_logs/global_u2_r_ryans_dhdft_inputs_exess_exess_inputs_isomers_31120-31139_topology_9.json
************************************************************
**************** Running topology 11 of 20 *****************
************************************************************

************************************************************
******** Beginning RI-REVDSD-PBEP86-D4(NOFC) energy ********
************************************************************

Created 3055110 / 16064064 significant shell pairs
Created 2041804 / 10419984 significant shell pairs
Total number of grid points: 686654 (10097 per atom)
Total number of grid points: 687229 (10106 per atom)
Total number of grid points: 686488 (10095 per atom)
Octree generated 447 batches
Octree generated 438 batches
Octree generated 443 batches
Total number of grid points: 687509 (10110 per atom)
Octree generated 440 batches
Creating 447 batches. Average size: 1310, max size: 2045
Batching took 0.360865 seconds (33.77 MB)
Creating 438 batches. Average size: 1338, max size: 2047
Batching took 0.355515 seconds (33.42 MB)
Creating 443 batches. Average size: 1316, max size: 2047
Batching took 0.357206 seconds (33.59 MB)
Creating 440 batches. Average size: 1326, max size: 2048
Batching took 0.357184 seconds (33.61 MB)
One electron integrals and orthogonalizer took 0.241170s
Created 2041804 / 10419984 significant shell pairs
3C integrals and B formation took 10.232093s
Iteration |      Energy      |  DIIS Metric   | Fock Time (s) | DIIS Time (s)
----------+------------------+----------------+---------------+--------------
    1     | -1700.4132580346 |   2.4868e+03   |   13.3689     |    0.1542
    2     | -1683.9940969960 |   4.6270e+00   |    2.4874     |    0.1579
    3     | -1684.6782223477 |   1.1919e+00   |    2.4858     |    0.1611
    4     | -1684.8226952950 |   2.1744e-01   |    2.4866     |    0.1642
    5     | -1684.8517975903 |   4.5034e-02   |    2.4856     |    0.1673
    6     | -1684.8583590894 |   2.4192e-03   |    2.4904     |    0.1704
    7     | -1684.8587238816 |   5.3267e-04   |    2.4884     |    0.1736
    8     | -1684.8588135516 |   4.6998e-05   |    2.4881     |    0.1767
    9     | -1684.8588233859 |   1.3872e-05   |    2.4883     |    0.1765
   10     | -1684.8588256920 |   1.1790e-06   |    2.4970     |    0.1768
   11     | -1684.8588258862 |   2.2439e-07   |    2.4856     |    0.1768
   12     | -1684.8588259262 |   1.5587e-08   |    2.4914     |    0.1767
   13     | -1684.8588259308 |   4.6702e-09   |    2.4883     |    0.1767
   14     | -1684.8588259323 |   8.8353e-10   |    2.4886     |    0.1767
   15     | -1684.8588259326 |   2.7900e-10   |    2.4876     |    0.1767
   16     | -1684.8588259327 |   7.6083e-11   |    2.4909     |    0.1767
=======================================================
         REVDSD-PBEP86-D4(NOFC) Energy Results         
=======================================================
E REVDSD-PBEP86-D4(NOFC): -1684.85882593
Nuclear Repulsion Energy: 4571.52510217
Electronic Energy:        -6178.79289694
XC Energy:                -77.591031
Converged:                1
# of SCF iterations:      16
SCF Time:                 64.854s
************************************************************
***************** Beginning RI-MP2 energy ******************
************************************************************

Created 2041804 / 10419984 significant shell pairs
=======================================================
                 RI-MP2 Energy Results                 
=======================================================
E OS:  -7.02940808047
E SS:  -2.33111051505
E MP2: -9.36051859552
Time:  32.684s

=======================================================
            Individual Calculation Summary             
=======================================================
HF Energy: -1684.8588259326995740
MP2 OS Energy: -4.2028830913103405
MP2 SS Energy: -0.1331064104093706
MP2 Total Energy: -4.3359895017197108
MP2 Corrected Energy: -1689.1948154344192972
=======================================================


Topology 10 time: 98.303398 s, performance: SP: 0 FLOP/s, DP: 41.47 TFLOP/s
JSON file written to: json_logs/global_u2_r_ryans_dhdft_inputs_exess_exess_inputs_isomers_31120-31139_topology_10.json
************************************************************
**************** Running topology 12 of 20 *****************
************************************************************

************************************************************
******** Beginning RI-REVDSD-PBEP86-D4(NOFC) energy ********
************************************************************

Created 3110748 / 16064064 significant shell pairs
Created 2081801 / 10419984 significant shell pairs
Total number of grid points: 687155 (10105 per atom)
Total number of grid points: 687677 (10112 per atom)
Total number of grid points: 687127 (10104 per atom)
Octree generated 446 batches
Total number of grid points: 685921 (10087 per atom)
Octree generated 438 batches
Octree generated 451 batches
Octree generated 440 batches
Creating 446 batches. Average size: 1308, max size: 2033
Batching took 0.363776 seconds (34.29 MB)
Creating 438 batches. Average size: 1334, max size: 2046
Batching took 0.365123 seconds (33.58 MB)
Creating 451 batches. Average size: 1300, max size: 2046
Batching took 0.367945 seconds (34.58 MB)
Creating 440 batches. Average size: 1326, max size: 2047
Batching took 0.359979 seconds (33.77 MB)
One electron integrals and orthogonalizer took 0.247024s
Created 2081801 / 10419984 significant shell pairs
3C integrals and B formation took 10.802257s
Iteration |      Energy      |  DIIS Metric   | Fock Time (s) | DIIS Time (s)
----------+------------------+----------------+---------------+--------------
    1     | -1700.6740373581 |   2.5034e+03   |   13.3792     |    0.1537
    2     | -1684.0073842722 |   4.5276e+00   |    2.5287     |    0.1574
    3     | -1684.6828242930 |   1.1714e+00   |    2.5271     |    0.1605
    4     | -1684.8234390786 |   2.0500e-01   |    2.5260     |    0.1638
    5     | -1684.8503625968 |   4.3336e-02   |    2.5245     |    0.1669
    6     | -1684.8564914251 |   2.4076e-03   |    2.5212     |    0.1700
    7     | -1684.8568548053 |   5.7359e-04   |    2.5276     |    0.1732
    8     | -1684.8569475177 |   5.0956e-05   |    2.5243     |    0.1763
    9     | -1684.8569578428 |   1.5586e-05   |    2.5259     |    0.1765
   10     | -1684.8569604256 |   8.7277e-07   |    2.5229     |    0.1764
   11     | -1684.8569605727 |   2.0676e-07   |    2.5249     |    0.1763
   12     | -1684.8569606082 |   1.8043e-08   |    2.5258     |    0.1762
   13     | -1684.8569606137 |   6.7248e-09   |    2.5235     |    0.1762
   14     | -1684.8569606156 |   1.4831e-09   |    2.5273     |    0.1764
   15     | -1684.8569606161 |   4.0159e-10   |    2.5287     |    0.1761
   16     | -1684.8569606162 |   9.4798e-11   |    2.5225     |    0.1763
=======================================================
         REVDSD-PBEP86-D4(NOFC) Energy Results         
=======================================================
E REVDSD-PBEP86-D4(NOFC): -1684.85696062
Nuclear Repulsion Energy: 4634.31237579
Electronic Energy:        -6241.57640037
XC Energy:                -77.592936
Converged:                1
# of SCF iterations:      16
SCF Time:                 65.968s
************************************************************
***************** Beginning RI-MP2 energy ******************
************************************************************

Created 2081801 / 10419984 significant shell pairs
=======================================================
                 RI-MP2 Energy Results                 
=======================================================
E OS:  -7.03041276471
E SS:  -2.33285364736
E MP2: -9.36326641207
Time:  32.585s

=======================================================
            Individual Calculation Summary             
=======================================================
HF Energy: -1684.8569606162152468
MP2 OS Energy: -4.2034837920189663
MP2 SS Energy: -0.1332059432642187
MP2 Total Energy: -4.3366897352831852
MP2 Corrected Energy: -1689.1936503514984906
=======================================================


Topology 11 time: 99.331056 s, performance: SP: 0 FLOP/s, DP: 41.17 TFLOP/s
JSON file written to: json_logs/global_u2_r_ryans_dhdft_inputs_exess_exess_inputs_isomers_31120-31139_topology_11.json
************************************************************
**************** Running topology 13 of 20 *****************
************************************************************

************************************************************
******** Beginning RI-REVDSD-PBEP86-D4(NOFC) energy ********
************************************************************

Created 3291533 / 16064064 significant shell pairs
Created 2205057 / 10419984 significant shell pairs
Total number of grid points: 686943 (10102 per atom)
Total number of grid points: 686973 (10102 per atom)
Total number of grid points: 687208 (10106 per atom)
Total number of grid points: 686756 (10099 per atom)
Octree generated 439 batches
Octree generated 449 batches
Octree generated 437 batches
Octree generated 438 batches
Creating 439 batches. Average size: 1321, max size: 2048
Batching took 0.375503 seconds (34.5 MB)
Creating 449 batches. Average size: 1297, max size: 2047
Batching took 0.376696 seconds (35.08 MB)
Creating 437 batches. Average size: 1333, max size: 2042
Batching took 0.374883 seconds (34.4 MB)
Creating 438 batches. Average size: 1333, max size: 2045
Batching took 0.371223 seconds (34.39 MB)
One electron integrals and orthogonalizer took 0.243716s
Created 2205057 / 10419984 significant shell pairs
3C integrals and B formation took 10.405631s
Iteration |      Energy      |  DIIS Metric   | Fock Time (s) | DIIS Time (s)
----------+------------------+----------------+---------------+--------------
    1     | -1700.2902325711 |   2.4807e+03   |   13.4532     |    0.1539
    2     | -1683.9361715567 |   4.9359e+00   |    2.6233     |    0.1576
    3     | -1684.6434188034 |   1.3608e+00   |    2.5969     |    0.1607
    4     | -1684.8061216593 |   2.4390e-01   |    2.5953     |    0.1638
    5     | -1684.8378396677 |   5.6016e-02   |    2.5997     |    0.1670
    6     | -1684.8460211359 |   3.5061e-03   |    2.5936     |    0.1702
    7     | -1684.8465504607 |   6.1078e-04   |    2.6213     |    0.1733
    8     | -1684.8466615373 |   6.3506e-05   |    2.6158     |    0.1764
    9     | -1684.8466746483 |   1.7874e-05   |    2.6194     |    0.1764
   10     | -1684.8466776347 |   1.3202e-06   |    2.6085     |    0.1765
   11     | -1684.8466778600 |   3.2230e-07   |    2.5947     |    0.1764
   12     | -1684.8466779205 |   3.7925e-08   |    2.6147     |    0.1766
   13     | -1684.8466779314 |   1.2097e-08   |    2.6031     |    0.1764
   14     | -1684.8466779355 |   2.3973e-09   |    2.6150     |    0.1763
   15     | -1684.8466779364 |   7.7263e-10   |    2.6140     |    0.1765
   16     | -1684.8466779366 |   1.9616e-10   |    2.6007     |    0.1764
   17     | -1684.8466779367 |   5.5858e-11   |    2.6075     |    0.1764
=======================================================
         REVDSD-PBEP86-D4(NOFC) Energy Results         
=======================================================
E REVDSD-PBEP86-D4(NOFC): -1684.84667794
Nuclear Repulsion Energy: 4751.10013761
Electronic Energy:        -6358.35319999
XC Energy:                -77.593616
Converged:                1
# of SCF iterations:      17
SCF Time:                 69.708s
************************************************************
***************** Beginning RI-MP2 energy ******************
************************************************************

Created 2205057 / 10419984 significant shell pairs
=======================================================
                 RI-MP2 Energy Results                 
=======================================================
E OS:  -7.03986883413
E SS:  -2.3384748061
E MP2: -9.37834364023
Time:  33.287s

=======================================================
            Individual Calculation Summary             
=======================================================
HF Energy: -1684.8466779367183790
MP2 OS Energy: -4.2091375759266469
MP2 SS Energy: -0.1335269114280470
MP2 Total Energy: -4.3426644873546936
MP2 Corrected Energy: -1689.1893424240731747
=======================================================


Topology 12 time: 103.804487 s, performance: SP: 0 FLOP/s, DP: 40.55 TFLOP/s
JSON file written to: json_logs/global_u2_r_ryans_dhdft_inputs_exess_exess_inputs_isomers_31120-31139_topology_12.json
************************************************************
**************** Running topology 14 of 20 *****************
************************************************************

************************************************************
******** Beginning RI-REVDSD-PBEP86-D4(NOFC) energy ********
************************************************************

Created 3125077 / 16064064 significant shell pairs
Created 2091640 / 10419984 significant shell pairs
Total number of grid points: 687223 (10106 per atom)
Total number of grid points: 686599 (10097 per atom)
Total number of grid points: 687312 (10107 per atom)
Total number of grid points: 686746 (10099 per atom)
Octree generated 447 batches
Octree generated 446 batches
Octree generated 448 batches
Octree generated 441 batches
Creating 447 batches. Average size: 1309, max size: 2046
Batching took 0.366053 seconds (34.47 MB)
Creating 446 batches. Average size: 1307, max size: 2038
Batching took 0.368178 seconds (34.52 MB)
Creating 441 batches. Average size: 1318, max size: 2048
Batching took 0.360136 seconds (33.87 MB)
Creating 448 batches. Average size: 1303, max size: 2038
Batching took 0.366553 seconds (34.5 MB)
One electron integrals and orthogonalizer took 0.246359s
Created 2091640 / 10419984 significant shell pairs
3C integrals and B formation took 10.795230s
Iteration |      Energy      |  DIIS Metric   | Fock Time (s) | DIIS Time (s)
----------+------------------+----------------+---------------+--------------
    1     | -1700.1181277804 |   2.4631e+03   |   13.3814     |    0.1559
    2     | -1683.9383030095 |   4.9320e+00   |    2.5560     |    0.1594
    3     | -1684.6440645164 |   1.3634e+00   |    2.5364     |    0.1628
    4     | -1684.8102418452 |   2.3110e-01   |    2.5400     |    0.1658
    5     | -1684.8410897514 |   5.1189e-02   |    2.5206     |    0.1689
    6     | -1684.8485374110 |   2.5415e-03   |    2.5245     |    0.1722
    7     | -1684.8489285692 |   6.1805e-04   |    2.5361     |    0.1751
    8     | -1684.8490345950 |   6.3977e-05   |    2.5188     |    0.1784
    9     | -1684.8490478281 |   1.8079e-05   |    2.5206     |    0.1783
   10     | -1684.8490509606 |   1.0919e-06   |    2.5195     |    0.1782
   11     | -1684.8490511573 |   2.6500e-07   |    2.5221     |    0.1783
   12     | -1684.8490512070 |   2.5413e-08   |    2.5200     |    0.1784
   13     | -1684.8490512149 |   9.1938e-09   |    2.5241     |    0.1784
   14     | -1684.8490512178 |   1.7090e-09   |    2.5216     |    0.1784
   15     | -1684.8490512185 |   4.6836e-10   |    2.5292     |    0.1784
   16     | -1684.8490512187 |   1.1340e-10   |    2.5215     |    0.1784
   17     | -1684.8490512187 |   4.0233e-11   |    2.5179     |    0.1782
=======================================================
         REVDSD-PBEP86-D4(NOFC) Energy Results         
=======================================================
E REVDSD-PBEP86-D4(NOFC): -1684.84905122
Nuclear Repulsion Energy: 4628.47597798
Electronic Energy:        -6235.7342
XC Energy:                -77.590829
Converged:                1
# of SCF iterations:      17
SCF Time:                 68.704s
************************************************************
***************** Beginning RI-MP2 energy ******************
************************************************************

Created 2091640 / 10419984 significant shell pairs
