
                 _..--+~/@-~--.      _____  __  __  _____   ____    ____
             _-=~      (  .   "}    | ____| \ \/ / | ____| / ___|  / ___|
          _-~     _.--=.\ \""""     |  _|    \  /  |  _|   \___ \  \___ \
        _~      _-       \ \_\      | |___   /  \  | |___   ___) |  ___) |
       =      _=          '--'      |_____| /_/\_\ |_____| |____/  |____/
      '      =
     :      :     ____            EXtreme-scale Electronic Structure System
___ |      ;                               Enjoy the power of GPUs!
    ;       ;                            Gordon Bell Award Winner 2024
  ___=       \ ___ __     __..-...__
     :        =_     _.-~~          ~~--.__
_____ \         ~-+-~                   ___~=_______
       == ...______ __ ___ _--~~--_
  

------------------------------------------------------------------------------

    * Giuseppe Barca         * Hamish Brown           * Jorge Galvez-Vallejo
    * Andrew Gilbert         * Min Htoo               * Fazeleh Kazemian    
    * Sean Laguna            * Jack Miller            * Elise Palethorpe    
    * Oliver Pulsford        * Ross Pure              * Christopher Seidl   
    * Dylan Silke            * Joshua Singla          * Calum Snowdon       
    * Ryan Stocks            * Ryan Swart             * Fiona Yu            

Commit no. used aedfa7ed9d5dfb1d6a4530fc669e9d390dc3eedd
Start of Calculation Local time: 2025-10-20 02:30:29
Start of Calculation UTC time:   2025-10-20 09:30:29
------------------------------------------------------------------------------

├── Calculation params
│   ├── Title: /global/u2/r/ryans/dhdft/inputs/exess/exess_inputs/isomers_31920-31939
│   ├── Driver: Energy
│   ├── Model
│   │   ├── Theory level: KS DFT
│   │   ├── Spin configuration: Restricted
│   │   ├── Primary basis: def2-QZVPP
│   │   ├── Auxiliary basis: def2-QZVPP-RIFIT
│   │   ├── Force cartesian basis sets: False
│   │   ├── Standard orientation: None
│   ├── Topologies
│   │   ├── Number of topologies: 20
│   ├── Keywords
│   │   ├── SCF keywords
│   │   │   ├── Max iterations: 50
│   │   │   ├── Batch size: 2560
│   │   │   ├── DIIS size: 8
│   │   │   ├── Convergence threshold: 1.000e-10
│   │   │   ├── Use guess fallback: False
│   │   │   ├── Convergence metric: DIIS
│   │   │   ├── Density threshold: 1.000e-10
│   │   │   ├── Gradient screening threshold: 1.000e-10
│   │   │   ├── Allow crap scf: False
│   │   │   ├── Fock build type: RI
│   │   │   ├── Group shared exponents: False
│   │   │   ├── Store RI B tensor on host: False
│   │   │   ├── Compress B tensor shell pairs: True
│   │   ├── KS
│   │   │   ├── Functional: REVDSD-PBEP86-D4(NOFC)
│   │   │   ├── Method: BatchDense
│   │   │   ├── Hybrid: True
│   │   │   ├── Grid
│   │   │   │   ├── RadialQuad: MuraKnowles
│   │   │   │   ├── PruningScheme: ROBUST
│   │   │   │   ├── Consider weight zero: 1.000e-15
│   │   │   │   ├── Octree
│   │   │   │   │   ├── Max size: 2048
│   │   │   │   │   ├── Max depth: 18446744073709551615
│   │   │   │   │   ├── Max distance: -2147483648
│   │   │   │   │   ├── Combine small children: Some(1)
│   │   │   │   ├── GridDefaults: ULTRAFINE
│   │   │   ├── Use C optimization: False
│   │   │   ├── Double precision threshold: 1.000e-10
│   │   │   ├── Batches per batch: 30
│   │   ├── RTAT keywords
│   │   │   ├── Enabled: True
│   │   ├── Debug keywords
│   │   │   ├── Dry run: False
│   │   │   ├── Skip calcs: False
│   │   │   ├── Subfragment XYZ debug: False
│   │   ├── Export Keywords
│   │   │   ├── Not exporting any matrices
│   │   ├── Guess keywords
│   │   │   ├── Superposition of monomer densities: False
│   │   │   ├── Superposition of subfragment densities: False
│   │   │   ├── Basis set projection: False
│   │   ├── Boundary keywords
│   │   │   ├── X
│   │   │   │   ├── Type: None
│   │   │   ├── Y
│   │   │   │   ├── Type: None
│   │   │   ├── Z
│   │   │   │   ├── Type: None
│   │   ├── Logging
│   │   │   ├── Restricted logs visible
│   │   │   ├── Console logging
│   │   │   │   ├── Level: INFO
│   │   │   │   ├── Use log level colors: False
│   │   ├── Integrals Keywords
│   │   │   ├── Scheduler: Callback
│   │   │   ├── Number of streams: 4
│   ├── System
│   │   ├── Max GPU Memory: 54 GB
│   │   ├── Oversubscribe GPUs: False
│   │   ├── Teams per node: 1

************************************************************
****** Doing a batched calculation with 20 topologies ******
************************************************************

************************************************************
***************** Running topology 1 of 20 *****************
************************************************************

************************************************************
******** Beginning RI-REVDSD-PBEP86-D4(NOFC) energy ********
************************************************************

Created 2969447 / 16064064 significant shell pairs
Created 1980603 / 10419984 significant shell pairs
Total number of grid points: 687094 (10104 per atom)
Total number of grid points: 686992 (10102 per atom)
Total number of grid points: 686968 (10102 per atom)
Octree generated 439 batches
Octree generated 452 batches
Total number of grid points: 686826 (10100 per atom)
Octree generated 447 batches
Octree generated 452 batches
Creating 439 batches. Average size: 1329, max size: 2043
Batching took 0.411439 seconds (33.33 MB)
Creating 452 batches. Average size: 1292, max size: 2038
Batching took 0.417222 seconds (34.05 MB)
Creating 447 batches. Average size: 1307, max size: 2047
Batching took 0.419704 seconds (33.73 MB)
Creating 452 batches. Average size: 1297, max size: 2047
Batching took 0.432024 seconds (33.94 MB)
One electron integrals and orthogonalizer took 0.625257s
Created 1980603 / 10419984 significant shell pairs
3C integrals and B formation took 12.090406s
Iteration |      Energy      |  DIIS Metric   | Fock Time (s) | DIIS Time (s)
----------+------------------+----------------+---------------+--------------
    1     | -1702.2753808952 |   2.5439e+03   |   16.5758     |    0.2229
    2     | -1683.8805360228 |   4.8574e+00   |    2.4829     |    0.1602
    3     | -1684.6098841929 |   1.4811e+00   |    2.4643     |    0.1633
    4     | -1684.7879147920 |   2.8996e-01   |    2.4562     |    0.1666
    5     | -1684.8277928951 |   6.6131e-02   |    2.4620     |    0.1692
    6     | -1684.8380813004 |   4.3744e-03   |    2.4559     |    0.1725
    7     | -1684.8388017016 |   8.3262e-04   |    2.4558     |    0.1757
    8     | -1684.8389578005 |   6.8738e-05   |    2.4603     |    0.1786
    9     | -1684.8389708902 |   1.6906e-05   |    2.4589     |    0.1793
   10     | -1684.8389735559 |   1.1269e-06   |    2.4582     |    0.1794
   11     | -1684.8389737753 |   3.0223e-07   |    2.4617     |    0.1803
   12     | -1684.8389738414 |   3.6146e-08   |    2.4681     |    0.1787
   13     | -1684.8389738566 |   1.1882e-08   |    2.4642     |    0.1787
   14     | -1684.8389738603 |   1.7688e-09   |    2.4563     |    0.1786
   15     | -1684.8389738609 |   5.9732e-10   |    2.4593     |    0.1785
   16     | -1684.8389738611 |   1.4359e-10   |    2.4595     |    0.1784
   17     | -1684.8389738611 |   4.0183e-11   |    2.4585     |    0.1787
=======================================================
         REVDSD-PBEP86-D4(NOFC) Energy Results         
=======================================================
E REVDSD-PBEP86-D4(NOFC): -1684.83897386
Nuclear Repulsion Energy: 4465.17248408
Electronic Energy:        -6072.42613578
XC Energy:                -77.585322
Converged:                1
# of SCF iterations:      17
SCF Time:                 72.982s
************************************************************
***************** Beginning RI-MP2 energy ******************
************************************************************

Created 1980603 / 10419984 significant shell pairs
=======================================================
                 RI-MP2 Energy Results                 
=======================================================
E OS:  -7.03442151828
E SS:  -2.32987453887
E MP2: -9.36429605715
Time:  33.264s

=======================================================
            Individual Calculation Summary             
=======================================================
HF Energy: -1684.8389738611049324
MP2 OS Energy: -4.2058806257796846
MP2 SS Energy: -0.1330358361694196
MP2 Total Energy: -4.3389164619491041
MP2 Corrected Energy: -1689.1778903230540436
=======================================================


Topology 0 time: 129.620690 s, performance: SP: 0 FLOP/s, DP: 31.87 TFLOP/s
JSON file written to: json_logs/global_u2_r_ryans_dhdft_inputs_exess_exess_inputs_isomers_31920-31939_topology_0.json
************************************************************
***************** Running topology 2 of 20 *****************
************************************************************

************************************************************
******** Beginning RI-REVDSD-PBEP86-D4(NOFC) energy ********
************************************************************

Created 2993762 / 16064064 significant shell pairs
Created 1998928 / 10419984 significant shell pairs
Total number of grid points: 687004 (10103 per atom)
Total number of grid points: 687097 (10104 per atom)
Total number of grid points: 686910 (10101 per atom)
Total number of grid points: 686869 (10101 per atom)
Octree generated 447 batches
Octree generated 448 batches
Octree generated 446 batches
Octree generated 442 batches
Creating 447 batches. Average size: 1310, max size: 2048
Batching took 0.356049 seconds (33.66 MB)
Creating 448 batches. Average size: 1307, max size: 2043
Batching took 0.355725 seconds (33.87 MB)
Creating 442 batches. Average size: 1325, max size: 2041
Batching took 0.354220 seconds (33.4 MB)
Creating 446 batches. Average size: 1305, max size: 2048
Batching took 0.356728 seconds (33.62 MB)
One electron integrals and orthogonalizer took 0.217259s
Created 1998928 / 10419984 significant shell pairs
3C integrals and B formation took 8.916105s
Iteration |      Energy      |  DIIS Metric   | Fock Time (s) | DIIS Time (s)
----------+------------------+----------------+---------------+--------------
    1     | -1701.8096418205 |   2.5275e+03   |   13.3661     |    0.1569
    2     | -1683.8941434454 |   4.8461e+00   |    2.4961     |    0.1605
    3     | -1684.6123917680 |   1.4749e+00   |    2.4724     |    0.1634
    4     | -1684.7832252018 |   3.3128e-01   |    2.4662     |    0.1668
    5     | -1684.8273346158 |   7.3404e-02   |    2.4736     |    0.1699
    6     | -1684.8387065755 |   4.5557e-03   |    2.4608     |    0.1731
    7     | -1684.8394444470 |   8.2550e-04   |    2.4654     |    0.1761
    8     | -1684.8395982173 |   7.0941e-05   |    2.4627     |    0.1788
    9     | -1684.8396117228 |   1.7315e-05   |    2.4621     |    0.1785
   10     | -1684.8396145060 |   1.1005e-06   |    2.4615     |    0.1785
   11     | -1684.8396147353 |   2.8596e-07   |    2.4628     |    0.1786
   12     | -1684.8396148032 |   4.0277e-08   |    2.4626     |    0.1786
   13     | -1684.8396148214 |   1.5204e-08   |    2.4597     |    0.1786
   14     | -1684.8396148267 |   2.4947e-09   |    2.4610     |    0.1785
   15     | -1684.8396148277 |   8.8025e-10   |    2.4629     |    0.1784
   16     | -1684.8396148280 |   2.5723e-10   |    2.4617     |    0.1785
   17     | -1684.8396148281 |   5.7828e-11   |    2.4616     |    0.1785
=======================================================
         REVDSD-PBEP86-D4(NOFC) Energy Results         
=======================================================
E REVDSD-PBEP86-D4(NOFC): -1684.83961483
Nuclear Repulsion Energy: 4499.31397548
Electronic Energy:        -6106.56805289
XC Energy:                -77.585537
Converged:                1
# of SCF iterations:      17
SCF Time:                 65.84s
************************************************************
***************** Beginning RI-MP2 energy ******************
************************************************************

Created 1998928 / 10419984 significant shell pairs
=======================================================
                 RI-MP2 Energy Results                 
=======================================================
E OS:  -7.03468715455
E SS:  -2.33021625814
E MP2: -9.36490341268
Time:  32.572s

=======================================================
            Individual Calculation Summary             
=======================================================
HF Energy: -1684.8396148281267415
MP2 OS Energy: -4.2060394497033897
MP2 SS Energy: -0.1330553483396694
MP2 Total Energy: -4.3390947980430594
MP2 Corrected Energy: -1689.1787096261698480
=======================================================


Topology 1 time: 99.139945 s, performance: SP: 0 FLOP/s, DP: 41.68 TFLOP/s
JSON file written to: json_logs/global_u2_r_ryans_dhdft_inputs_exess_exess_inputs_isomers_31920-31939_topology_1.json
************************************************************
***************** Running topology 3 of 20 *****************
************************************************************

************************************************************
******** Beginning RI-REVDSD-PBEP86-D4(NOFC) energy ********
************************************************************

Created 2969286 / 16064064 significant shell pairs
Created 1984100 / 10419984 significant shell pairs
Total number of grid points: 686893 (10101 per atom)
Total number of grid points: 687520 (10110 per atom)
Octree generated 441 batches
Total number of grid points: 686615 (10097 per atom)
Total number of grid points: 686852 (10100 per atom)
Octree generated 434 batches
Octree generated 448 batches
Octree generated 446 batches
Creating 441 batches. Average size: 1324, max size: 2045
Batching took 0.359235 seconds (33.32 MB)
Creating 434 batches. Average size: 1349, max size: 2041
Batching took 0.345996 seconds (32.65 MB)
Creating 448 batches. Average size: 1302, max size: 2046
Batching took 0.351246 seconds (33.52 MB)
Creating 446 batches. Average size: 1318, max size: 2045
Batching took 0.352335 seconds (33.6 MB)
One electron integrals and orthogonalizer took 0.222202s
Created 1984100 / 10419984 significant shell pairs
3C integrals and B formation took 8.862315s
Iteration |      Energy      |  DIIS Metric   | Fock Time (s) | DIIS Time (s)
----------+------------------+----------------+---------------+--------------
    1     | -1701.9229515720 |   2.5708e+03   |   13.3777     |    0.1568
    2     | -1684.1320651298 |   3.6531e+00   |    2.4664     |    0.1604
    3     | -1684.7254483326 |   8.6696e-01   |    2.4651     |    0.1637
    4     | -1684.8178957643 |   2.5948e-01   |    2.4617     |    0.1666
    5     | -1684.8525684285 |   3.0306e-02   |    2.4634     |    0.1698
    6     | -1684.8568669407 |   2.7365e-03   |    2.4628     |    0.1731
    7     | -1684.8572739843 |   6.1958e-04   |    2.4648     |    0.1761
    8     | -1684.8573735197 |   5.4238e-05   |    2.4613     |    0.1784
    9     | -1684.8573858020 |   1.0010e-05   |    2.4601     |    0.1783
   10     | -1684.8573878693 |   7.6113e-07   |    2.4586     |    0.1786
   11     | -1684.8573880373 |   2.0703e-07   |    2.4658     |    0.1784
   12     | -1684.8573880849 |   2.1525e-08   |    2.4598     |    0.1785
   13     | -1684.8573880936 |   6.4415e-09   |    2.4594     |    0.1785
   14     | -1684.8573880959 |   9.6295e-10   |    2.4567     |    0.1784
   15     | -1684.8573880963 |   3.6731e-10   |    2.4581     |    0.1784
   16     | -1684.8573880964 |   7.7039e-11   |    2.4578     |    0.1783
=======================================================
         REVDSD-PBEP86-D4(NOFC) Energy Results         
=======================================================
E REVDSD-PBEP86-D4(NOFC): -1684.8573881
Nuclear Repulsion Energy: 4492.379616
Electronic Energy:        -6099.65117595
XC Energy:                -77.585828
Converged:                1
# of SCF iterations:      16
SCF Time:                 63.109s
************************************************************
***************** Beginning RI-MP2 energy ******************
************************************************************

Created 1984100 / 10419984 significant shell pairs
=======================================================
                 RI-MP2 Energy Results                 
=======================================================
E OS:  -7.02983307613
E SS:  -2.32749441252
E MP2: -9.35732748865
Time:  32.478s

=======================================================
            Individual Calculation Summary             
=======================================================
HF Energy: -1684.8573880963958800
MP2 OS Energy: -4.2031371962163542
MP2 SS Energy: -0.1328999309549891
MP2 Total Energy: -4.3360371271713429
MP2 Corrected Energy: -1689.1934252235671465
=======================================================


Topology 2 time: 96.315097 s, performance: SP: 0 FLOP/s, DP: 42.26 TFLOP/s
JSON file written to: json_logs/global_u2_r_ryans_dhdft_inputs_exess_exess_inputs_isomers_31920-31939_topology_2.json
************************************************************
***************** Running topology 4 of 20 *****************
************************************************************

************************************************************
******** Beginning RI-REVDSD-PBEP86-D4(NOFC) energy ********
************************************************************

Created 2913256 / 16064064 significant shell pairs
Created 1946141 / 10419984 significant shell pairs
Total number of grid points: 686831 (10100 per atom)
Total number of grid points: 686336 (10093 per atom)
Total number of grid points: 687328 (10107 per atom)
Total number of grid points: 687385 (10108 per atom)
Octree generated 430 batches
Octree generated 445 batches
Octree generated 451 batches
Octree generated 444 batches
Creating 430 batches. Average size: 1353, max size: 2044
Batching took 0.340160 seconds (32.06 MB)
Creating 445 batches. Average size: 1316, max size: 2046
Batching took 0.353444 seconds (33.14 MB)
Creating 451 batches. Average size: 1304, max size: 2045
Batching took 0.358349 seconds (33.62 MB)
Creating 444 batches. Average size: 1321, max size: 2047
Batching took 0.352407 seconds (33.15 MB)
One electron integrals and orthogonalizer took 0.224137s
Created 1946141 / 10419984 significant shell pairs
3C integrals and B formation took 8.437727s
Iteration |      Energy      |  DIIS Metric   | Fock Time (s) | DIIS Time (s)
----------+------------------+----------------+---------------+--------------
    1     | -1702.9484391387 |   2.5918e+03   |   13.3583     |    0.1557
    2     | -1684.0164138551 |   4.1234e+00   |    2.4597     |    0.1592
    3     | -1684.6580844580 |   1.2846e+00   |    2.4338     |    0.1626
    4     | -1684.8117943752 |   2.5365e-01   |    2.4308     |    0.1657
    5     | -1684.8490285031 |   3.2981e-02   |    2.4342     |    0.1689
    6     | -1684.8540975722 |   1.8861e-03   |    2.4284     |    0.1721
    7     | -1684.8544500250 |   4.8254e-04   |    2.4272     |    0.1752
    8     | -1684.8545291530 |   9.3173e-05   |    2.4278     |    0.1765
    9     | -1684.8545458254 |   1.2591e-05   |    2.4248     |    0.1766
   10     | -1684.8545481479 |   8.7230e-07   |    2.4292     |    0.1765
   11     | -1684.8545483834 |   2.0963e-07   |    2.4292     |    0.1765
   12     | -1684.8545484522 |   4.6569e-08   |    2.4393     |    0.1765
   13     | -1684.8545484758 |   1.1718e-08   |    2.4326     |    0.1767
   14     | -1684.8545484808 |   1.9958e-09   |    2.4305     |    0.1765
   15     | -1684.8545484818 |   5.7178e-10   |    2.4332     |    0.1765
   16     | -1684.8545484821 |   1.4097e-10   |    2.4327     |    0.1768
   17     | -1684.8545484821 |   2.4902e-11   |    2.4283     |    0.1764
=======================================================
         REVDSD-PBEP86-D4(NOFC) Energy Results         
=======================================================
E REVDSD-PBEP86-D4(NOFC): -1684.85454848
Nuclear Repulsion Energy: 4447.79982156
Electronic Energy:        -6055.06949532
XC Energy:                -77.584875
Converged:                1
# of SCF iterations:      17
SCF Time:                 64.799s
************************************************************
***************** Beginning RI-MP2 energy ******************
************************************************************

Created 1946141 / 10419984 significant shell pairs
=======================================================
                 RI-MP2 Energy Results                 
=======================================================
E OS:  -7.02796364659
E SS:  -2.32621704889
E MP2: -9.35418069548
Time:  32.713s

=======================================================
            Individual Calculation Summary             
=======================================================
HF Energy: -1684.8545484821440823
MP2 OS Energy: -4.2020194642950690
MP2 SS Energy: -0.1328269934918702
MP2 Total Energy: -4.3348464577869388
MP2 Corrected Energy: -1689.1893949399309349
=======================================================


Topology 3 time: 98.246679 s, performance: SP: 0 FLOP/s, DP: 41.85 TFLOP/s
JSON file written to: json_logs/global_u2_r_ryans_dhdft_inputs_exess_exess_inputs_isomers_31920-31939_topology_3.json
************************************************************
***************** Running topology 5 of 20 *****************
************************************************************

************************************************************
******** Beginning RI-REVDSD-PBEP86-D4(NOFC) energy ********
************************************************************

Created 2897710 / 16064064 significant shell pairs
Created 1933431 / 10419984 significant shell pairs
Total number of grid points: 687431 (10109 per atom)
Total number of grid points: 687194 (10105 per atom)
Total number of grid points: 686417 (10094 per atom)
Octree generated 455 batches
Octree generated 440 batches
Total number of grid points: 686838 (10100 per atom)
Octree generated 446 batches
Octree generated 454 batches
Creating 440 batches. Average size: 1333, max size: 2048
Batching took 0.348135 seconds (32.97 MB)
Creating 455 batches. Average size: 1288, max size: 2043
Batching took 0.356261 seconds (33.84 MB)
Creating 446 batches. Average size: 1307, max size: 2048
Batching took 0.358764 seconds (33.4 MB)
Creating 454 batches. Average size: 1293, max size: 2041
Batching took 0.361608 seconds (33.71 MB)
One electron integrals and orthogonalizer took 0.230714s
Created 1933431 / 10419984 significant shell pairs
3C integrals and B formation took 8.528695s
Iteration |      Energy      |  DIIS Metric   | Fock Time (s) | DIIS Time (s)
----------+------------------+----------------+---------------+--------------
    1     | -1700.5905457115 |   2.4777e+03   |   13.3205     |    0.1559
    2     | -1684.0209957561 |   4.4093e+00   |    2.4638     |    0.1597
    3     | -1684.6842932003 |   1.1329e+00   |    2.4381     |    0.1628
    4     | -1684.8202905870 |   2.3643e-01   |    2.4429     |    0.1659
    5     | -1684.8524023228 |   4.9096e-02   |    2.4396     |    0.1692
    6     | -1684.8596077498 |   2.9520e-03   |    2.4429     |    0.1722
    7     | -1684.8600415760 |   5.9297e-04   |    2.4434     |    0.1756
    8     | -1684.8601448948 |   6.6591e-05   |    2.4394     |    0.1785
    9     | -1684.8601593712 |   1.3624e-05   |    2.4473     |    0.1785
   10     | -1684.8601620125 |   1.2612e-06   |    2.4334     |    0.1786
   11     | -1684.8601622713 |   2.4279e-07   |    2.4344     |    0.1786
   12     | -1684.8601623290 |   2.7146e-08   |    2.4339     |    0.1785
   13     | -1684.8601623403 |   1.0528e-08   |    2.4350     |    0.1785
   14     | -1684.8601623441 |   1.6115e-09   |    2.4385     |    0.1789
   15     | -1684.8601623448 |   5.0800e-10   |    2.4341     |    0.1786
   16     | -1684.8601623450 |   1.3194e-10   |    2.4377     |    0.1787
   17     | -1684.8601623451 |   3.5579e-11   |    2.4366     |    0.1785
=======================================================
         REVDSD-PBEP86-D4(NOFC) Energy Results         
=======================================================
E REVDSD-PBEP86-D4(NOFC): -1684.86016235
Nuclear Repulsion Energy: 4412.54006057
Electronic Energy:        -6019.81443903
XC Energy:                -77.585784
Converged:                1
# of SCF iterations:      17
SCF Time:                 64.997s
************************************************************
***************** Beginning RI-MP2 energy ******************
************************************************************

Created 1933431 / 10419984 significant shell pairs
=======================================================
                 RI-MP2 Energy Results                 
=======================================================
E OS:  -7.02564164834
E SS:  -2.32535289158
E MP2: -9.35099453991
Time:  32.648s

=======================================================
            Individual Calculation Summary             
=======================================================
HF Energy: -1684.8601623450822444
MP2 OS Energy: -4.2006311415407565
MP2 SS Energy: -0.1327776501090177
MP2 Total Energy: -4.3334087916497737
MP2 Corrected Energy: -1689.1935711367320891
=======================================================


Topology 4 time: 98.385949 s, performance: SP: 0 FLOP/s, DP: 41.79 TFLOP/s
JSON file written to: json_logs/global_u2_r_ryans_dhdft_inputs_exess_exess_inputs_isomers_31920-31939_topology_4.json
************************************************************
***************** Running topology 6 of 20 *****************
************************************************************

************************************************************
******** Beginning RI-REVDSD-PBEP86-D4(NOFC) energy ********
************************************************************

Created 2771901 / 16064064 significant shell pairs
Created 1843918 / 10419984 significant shell pairs
Total number of grid points: 686610 (10097 per atom)
Total number of grid points: 687058 (10103 per atom)
Total number of grid points: 686986 (10102 per atom)
Total number of grid points: 687226 (10106 per atom)
Octree generated 440 batches
Octree generated 438 batches
Octree generated 446 batches
Octree generated 454 batches
Creating 440 batches. Average size: 1329, max size: 2044
Batching took 0.338385 seconds (32.47 MB)
Creating 438 batches. Average size: 1336, max size: 2048
Batching took 0.342336 seconds (32.41 MB)
Creating 446 batches. Average size: 1315, max size: 2046
Batching took 0.343397 seconds (32.78 MB)
Creating 454 batches. Average size: 1295, max size: 2048
Batching took 0.346478 seconds (33.44 MB)
One electron integrals and orthogonalizer took 0.227516s
Created 1843918 / 10419984 significant shell pairs
3C integrals and B formation took 7.795360s
Iteration |      Energy      |  DIIS Metric   | Fock Time (s) | DIIS Time (s)
----------+------------------+----------------+---------------+--------------
    1     | -1702.5144623233 |   2.5604e+03   |   13.3017     |    0.1542
    2     | -1684.0421355640 |   4.0660e+00   |    2.4017     |    0.1581
    3     | -1684.6946362249 |   1.1200e+00   |    2.3781     |    0.1611
    4     | -1684.8254436860 |   2.7662e-01   |    2.3728     |    0.1642
    5     | -1684.8649102811 |   4.4753e-02   |    2.3702     |    0.1673
    6     | -1684.8719015307 |   2.7258e-03   |    2.3747     |    0.1704
    7     | -1684.8723665479 |   5.9575e-04   |    2.3731     |    0.1739
    8     | -1684.8724716883 |   7.2943e-05   |    2.3697     |    0.1769
    9     | -1684.8724854500 |   1.0435e-05   |    2.3717     |    0.1769
   10     | -1684.8724873102 |   6.6295e-07   |    2.3692     |    0.1768
   11     | -1684.8724874583 |   1.8409e-07   |    2.3713     |    0.1768
   12     | -1684.8724875014 |   2.3149e-08   |    2.3701     |    0.1768
   13     | -1684.8724875113 |   7.6524e-09   |    2.3688     |    0.1769
   14     | -1684.8724875138 |   1.0075e-09   |    2.3738     |    0.1768
   15     | -1684.8724875142 |   3.4309e-10   |    2.3696     |    0.1769
   16     | -1684.8724875143 |   8.1272e-11   |    2.3713     |    0.1768
=======================================================
         REVDSD-PBEP86-D4(NOFC) Energy Results         
=======================================================
E REVDSD-PBEP86-D4(NOFC): -1684.87248751
Nuclear Repulsion Energy: 4264.92870749
Electronic Energy:        -5872.21836153
XC Energy:                -77.582833
Converged:                1
# of SCF iterations:      16
SCF Time:                 60.583s
************************************************************
***************** Beginning RI-MP2 energy ******************
************************************************************

Created 1843918 / 10419984 significant shell pairs
=======================================================
                 RI-MP2 Energy Results                 
=======================================================
E OS:  -7.02045977003
E SS:  -2.3204471761
E MP2: -9.34090694612
Time:  32.61s

=======================================================
            Individual Calculation Summary             
=======================================================
HF Energy: -1684.8724875143202553
MP2 OS Energy: -4.1975328964987586
MP2 SS Energy: -0.1324975337551152
MP2 Total Energy: -4.3300304302538741
MP2 Corrected Energy: -1689.2025179445740832
=======================================================


Topology 5 time: 93.896252 s, performance: SP: 0 FLOP/s, DP: 42.79 TFLOP/s
JSON file written to: json_logs/global_u2_r_ryans_dhdft_inputs_exess_exess_inputs_isomers_31920-31939_topology_5.json
************************************************************
***************** Running topology 7 of 20 *****************
************************************************************

************************************************************
******** Beginning RI-REVDSD-PBEP86-D4(NOFC) energy ********
************************************************************

Created 2773998 / 16064064 significant shell pairs
Created 1844974 / 10419984 significant shell pairs
Total number of grid points: 686784 (10099 per atom)
Total number of grid points: 686761 (10099 per atom)
Total number of grid points: 687160 (10105 per atom)
Octree generated 445 batches
Total number of grid points: 687175 (10105 per atom)
Octree generated 447 batches
Octree generated 460 batches
Octree generated 446 batches
Creating 445 batches. Average size: 1317, max size: 2045
Batching took 0.345773 seconds (32.81 MB)
Creating 447 batches. Average size: 1313, max size: 2046
Batching took 0.342643 seconds (33.07 MB)
Creating 460 batches. Average size: 1273, max size: 2043
Batching took 0.354451 seconds (33.88 MB)
Creating 446 batches. Average size: 1316, max size: 2044
Batching took 0.340868 seconds (32.73 MB)
One electron integrals and orthogonalizer took 0.244106s
Created 1844974 / 10419984 significant shell pairs
3C integrals and B formation took 7.736729s
Iteration |      Energy      |  DIIS Metric   | Fock Time (s) | DIIS Time (s)
----------+------------------+----------------+---------------+--------------
    1     | -1702.5171052204 |   2.5515e+03   |   13.2833     |    0.1558
    2     | -1684.0352709395 |   4.1510e+00   |    2.3666     |    0.1595
    3     | -1684.7153955112 |   1.0619e+00   |    2.3667     |    0.1627
    4     | -1684.8461550730 |   2.2616e-01   |    2.3694     |    0.1658
    5     | -1684.8785698373 |   4.6180e-02   |    2.3785     |    0.1693
    6     | -1684.8857314719 |   2.5215e-03   |    2.4107     |    0.1724
    7     | -1684.8861777349 |   5.6644e-04   |    2.4005     |    0.1752
    8     | -1684.8862764650 |   7.3172e-05   |    2.3783     |    0.1783
    9     | -1684.8862897382 |   8.5293e-06   |    2.3673     |    0.1784
   10     | -1684.8862911690 |   5.9618e-07   |    2.3655     |    0.1785
   11     | -1684.8862912846 |   1.6819e-07   |    2.3646     |    0.1783
   12     | -1684.8862913180 |   1.9884e-08   |    2.3670     |    0.1784
   13     | -1684.8862913248 |   6.6636e-09   |    2.3677     |    0.1784
   14     | -1684.8862913265 |   7.9985e-10   |    2.3689     |    0.1784
   15     | -1684.8862913268 |   2.7560e-10   |    2.3665     |    0.1782
   16     | -1684.8862913269 |   7.0727e-11   |    2.3700     |    0.1782
=======================================================
         REVDSD-PBEP86-D4(NOFC) Energy Results         
=======================================================
E REVDSD-PBEP86-D4(NOFC): -1684.88629133
Nuclear Repulsion Energy: 4272.51627297
Electronic Energy:        -5879.81705322
XC Energy:                -77.585511
Converged:                1
# of SCF iterations:      16
SCF Time:                 60.515s
************************************************************
***************** Beginning RI-MP2 energy ******************
************************************************************

Created 1844974 / 10419984 significant shell pairs
=======================================================
                 RI-MP2 Energy Results                 
=======================================================
E OS:  -7.01599513249
E SS:  -2.3191625632
E MP2: -9.3351576957
Time:  32.472s

=======================================================
            Individual Calculation Summary             
=======================================================
HF Energy: -1684.8862913268906141
MP2 OS Energy: -4.1948634897179602
MP2 SS Energy: -0.1324241823589880
MP2 Total Energy: -4.3272876720769480
MP2 Corrected Energy: -1689.2135789989674777
=======================================================


Topology 6 time: 93.704662 s, performance: SP: 0 FLOP/s, DP: 42.92 TFLOP/s
JSON file written to: json_logs/global_u2_r_ryans_dhdft_inputs_exess_exess_inputs_isomers_31920-31939_topology_6.json
************************************************************
***************** Running topology 8 of 20 *****************
************************************************************

************************************************************
******** Beginning RI-REVDSD-PBEP86-D4(NOFC) energy ********
************************************************************

Created 2821194 / 16064064 significant shell pairs
Created 1878923 / 10419984 significant shell pairs
Total number of grid points: 687434 (10109 per atom)
Total number of grid points: 686982 (10102 per atom)
Total number of grid points: 686613 (10097 per atom)
Octree generated 452 batches
Total number of grid points: 686851 (10100 per atom)
Octree generated 447 batches
Octree generated 441 batches
Octree generated 457 batches
Creating 452 batches. Average size: 1300, max size: 2042
Batching took 0.361476 seconds (33.66 MB)
Creating 447 batches. Average size: 1310, max size: 2045
Batching took 0.358219 seconds (33.37 MB)
Creating 441 batches. Average size: 1329, max size: 2047
Batching took 0.352257 seconds (33.13 MB)
Creating 457 batches. Average size: 1279, max size: 2045
Batching took 0.360143 seconds (33.92 MB)
One electron integrals and orthogonalizer took 0.238837s
Created 1878923 / 10419984 significant shell pairs
3C integrals and B formation took 7.977506s
Iteration |      Energy      |  DIIS Metric   | Fock Time (s) | DIIS Time (s)
----------+------------------+----------------+---------------+--------------
    1     | -1700.7225978841 |   2.4692e+03   |   13.3432     |    0.1541
    2     | -1684.0039974148 |   4.6719e+00   |    2.4437     |    0.1579
    3     | -1684.6823730051 |   1.3624e+00   |    2.4209     |    0.1611
    4     | -1684.8434751358 |   2.5622e-01   |    2.4135     |    0.1641
    5     | -1684.8783130762 |   4.8566e-02   |    2.4211     |    0.1673
    6     | -1684.8855484677 |   2.1206e-03   |    2.4199     |    0.1703
    7     | -1684.8858990934 |   4.3479e-04   |    2.4195     |    0.1736
    8     | -1684.8859757635 |   5.6089e-05   |    2.4134     |    0.1767
    9     | -1684.8859872595 |   1.0203e-05   |    2.4350     |    0.1767
   10     | -1684.8859890484 |   6.9840e-07   |    2.4515     |    0.1766
   11     | -1684.8859891872 |   2.1827e-07   |    2.4186     |    0.1767
   12     | -1684.8859892304 |   2.4375e-08   |    2.4109     |    0.1767
   13     | -1684.8859892395 |   8.9953e-09   |    2.4162     |    0.1766
   14     | -1684.8859892423 |   1.1779e-09   |    2.4117     |    0.1767
   15     | -1684.8859892428 |   3.6634e-10   |    2.4130     |    0.1767
   16     | -1684.8859892430 |   9.2910e-11   |    2.4343     |    0.1767
=======================================================
         REVDSD-PBEP86-D4(NOFC) Energy Results         
=======================================================
E REVDSD-PBEP86-D4(NOFC): -1684.88598924
Nuclear Repulsion Energy: 4324.56816768
Electronic Energy:        -5931.86863064
XC Energy:                -77.585526
Converged:                1
# of SCF iterations:      16
SCF Time:                 61.554s
************************************************************
***************** Beginning RI-MP2 energy ******************
************************************************************

Created 1878923 / 10419984 significant shell pairs
=======================================================
                 RI-MP2 Energy Results                 
=======================================================
E OS:  -7.01617513482
E SS:  -2.3193778567
E MP2: -9.33555299152
Time:  32.526s

=======================================================
            Individual Calculation Summary             
=======================================================
HF Energy: -1684.8859892429700267
MP2 OS Energy: -4.1949711131108227
MP2 SS Energy: -0.1324364756173137
MP2 Total Energy: -4.3274075887281365
MP2 Corrected Energy: -1689.2133968316982191
=======================================================


Topology 7 time: 94.791337 s, performance: SP: 0 FLOP/s, DP: 42.76 TFLOP/s
JSON file written to: json_logs/global_u2_r_ryans_dhdft_inputs_exess_exess_inputs_isomers_31920-31939_topology_7.json
************************************************************
***************** Running topology 9 of 20 *****************
************************************************************

************************************************************
******** Beginning RI-REVDSD-PBEP86-D4(NOFC) energy ********
************************************************************

Created 2770850 / 16064064 significant shell pairs
Created 1843069 / 10419984 significant shell pairs
Total number of grid points: 687440 (10109 per atom)
Total number of grid points: 686367 (10093 per atom)
Total number of grid points: 687049 (10103 per atom)
Total number of grid points: 687024 (10103 per atom)
Octree generated 456 batches
Octree generated 438 batches
Octree generated 456 batches
Octree generated 443 batches
Creating 456 batches. Average size: 1299, max size: 2039
Batching took 0.357027 seconds (33.65 MB)
Creating 438 batches. Average size: 1333, max size: 2048
Batching took 0.341219 seconds (32.19 MB)
Creating 456 batches. Average size: 1286, max size: 2043
Batching took 0.343512 seconds (33.46 MB)
Creating 443 batches. Average size: 1312, max size: 2045
Batching took 0.350035 seconds (32.8 MB)
One electron integrals and orthogonalizer took 0.250520s
Created 1843069 / 10419984 significant shell pairs
3C integrals and B formation took 7.812624s
Iteration |      Energy      |  DIIS Metric   | Fock Time (s) | DIIS Time (s)
----------+------------------+----------------+---------------+--------------
    1     | -1699.4773695132 |   2.4076e+03   |   13.3415     |    0.1560
    2     | -1683.9698200921 |   5.0735e+00   |    2.4130     |    0.1598
    3     | -1684.6810856556 |   1.3348e+00   |    2.3881     |    0.1628
    4     | -1684.8425313139 |   2.0612e-01   |    2.3857     |    0.1661
    5     | -1684.8683683066 |   4.7950e-02   |    2.3851     |    0.1690
    6     | -1684.8751736261 |   2.2285e-03   |    2.3870     |    0.1721
    7     | -1684.8755015887 |   3.6951e-04   |    2.3878     |    0.1752
    8     | -1684.8755656227 |   3.6191e-05   |    2.3861     |    0.1785
    9     | -1684.8755746803 |   9.6812e-06   |    2.3845     |    0.1785
   10     | -1684.8755767542 |   7.3136e-07   |    2.3873     |    0.1785
   11     | -1684.8755769202 |   2.1121e-07   |    2.3918     |    0.1784
   12     | -1684.8755769629 |   1.5070e-08   |    2.3848     |    0.1784
   13     | -1684.8755769682 |   5.6742e-09   |    2.3899     |    0.1784
   14     | -1684.8755769697 |   6.1699e-10   |    2.3866     |    0.1785
   15     | -1684.8755769700 |   2.0494e-10   |    2.3890     |    0.1785
   16     | -1684.8755769701 |   5.0480e-11   |    2.3862     |    0.1785
=======================================================
         REVDSD-PBEP86-D4(NOFC) Energy Results         
=======================================================
E REVDSD-PBEP86-D4(NOFC): -1684.87557697
Nuclear Repulsion Energy: 4260.19761072
Electronic Energy:        -5867.48986702
XC Energy:                -77.583321
Converged:                1
# of SCF iterations:      16
SCF Time:                 60.886s
************************************************************
***************** Beginning RI-MP2 energy ******************
************************************************************

Created 1843069 / 10419984 significant shell pairs
=======================================================
                 RI-MP2 Energy Results                 
=======================================================
E OS:  -7.01918785315
E SS:  -2.3199622593
E MP2: -9.33915011245
Time:  32.419s

=======================================================
            Individual Calculation Summary             
=======================================================
HF Energy: -1684.8755769700921974
MP2 OS Energy: -4.1967724173960947
MP2 SS Energy: -0.1324698450061444
MP2 Total Energy: -4.3292422624022393
MP2 Corrected Energy: -1689.2048192324944011
=======================================================


Topology 8 time: 94.023352 s, performance: SP: 0 FLOP/s, DP: 42.76 TFLOP/s
JSON file written to: json_logs/global_u2_r_ryans_dhdft_inputs_exess_exess_inputs_isomers_31920-31939_topology_8.json
************************************************************
**************** Running topology 10 of 20 *****************
************************************************************

************************************************************
******** Beginning RI-REVDSD-PBEP86-D4(NOFC) energy ********
************************************************************

Created 2858912 / 16064064 significant shell pairs
Created 1903355 / 10419984 significant shell pairs
Total number of grid points: 687039 (10103 per atom)
Total number of grid points: 687085 (10104 per atom)
Total number of grid points: 686305 (10092 per atom)
Octree generated 449 batches
Octree generated 449 batches
Total number of grid points: 687451 (10109 per atom)
Octree generated 454 batches
Octree generated 453 batches
Creating 449 batches. Average size: 1303, max size: 2044
Batching took 0.356826 seconds (33.4 MB)
Creating 449 batches. Average size: 1301, max size: 2044
Batching took 0.344148 seconds (33.31 MB)
Creating 454 batches. Average size: 1292, max size: 2042
Batching took 0.355791 seconds (33.76 MB)
Creating 453 batches. Average size: 1297, max size: 2046
Batching took 0.357104 seconds (33.58 MB)
One electron integrals and orthogonalizer took 0.247351s
Created 1903355 / 10419984 significant shell pairs
3C integrals and B formation took 8.219693s
Iteration |      Energy      |  DIIS Metric   | Fock Time (s) | DIIS Time (s)
----------+------------------+----------------+---------------+--------------
    1     | -1703.1286065940 |   2.5816e+03   |   13.3252     |    0.1542
    2     | -1683.9852500163 |   4.1416e+00   |    2.4515     |    0.1581
    3     | -1684.6902895818 |   9.9182e-01   |    2.4357     |    0.1610
    4     | -1684.8125383885 |   2.3372e-01   |    2.4332     |    0.1642
    5     | -1684.8451176307 |   5.6967e-02   |    2.4316     |    0.1671
    6     | -1684.8540398177 |   2.1455e-03   |    2.4221     |    0.1705
    7     | -1684.8544683731 |   5.6063e-04   |    2.4234     |    0.1736
    8     | -1684.8545651909 |   6.2108e-05   |    2.4266     |    0.1769
    9     | -1684.8545763238 |   1.0267e-05   |    2.4257     |    0.1766
   10     | -1684.8545780594 |   4.8206e-07   |    2.4281     |    0.1768
   11     | -1684.8545782167 |   1.8785e-07   |    2.4242     |    0.1766
   12     | -1684.8545782728 |   4.2228e-08   |    2.4271     |    0.1766
   13     | -1684.8545782973 |   9.9585e-09   |    2.4300     |    0.1768
   14     | -1684.8545783017 |   2.6658e-09   |    2.4266     |    0.1768
   15     | -1684.8545783028 |   5.1021e-10   |    2.4216     |    0.1766
   16     | -1684.8545783031 |   1.3579e-10   |    2.4267     |    0.1766
   17     | -1684.8545783031 |   2.8972e-11   |    2.4213     |    0.1766
=======================================================
         REVDSD-PBEP86-D4(NOFC) Energy Results         
=======================================================
E REVDSD-PBEP86-D4(NOFC): -1684.8545783
Nuclear Repulsion Energy: 4352.39025801
Electronic Energy:        -5959.65982502
XC Energy:                -77.585011
Converged:                1
# of SCF iterations:      17
SCF Time:                 64.498s
************************************************************
***************** Beginning RI-MP2 energy ******************
************************************************************

Created 1903355 / 10419984 significant shell pairs
=======================================================
                 RI-MP2 Energy Results                 
=======================================================
E OS:  -7.02572009451
E SS:  -2.324919887
E MP2: -9.35063998151
Time:  32.49s

=======================================================
            Individual Calculation Summary             
=======================================================
HF Energy: -1684.8545783031199790
MP2 OS Energy: -4.2006780445064482
MP2 SS Energy: -0.1327529255479322
MP2 Total Energy: -4.3334309700543807
MP2 Corrected Energy: -1689.1880092731744298
=======================================================


Topology 9 time: 97.703640 s, performance: SP: 0 FLOP/s, DP: 41.97 TFLOP/s
JSON file written to: json_logs/global_u2_r_ryans_dhdft_inputs_exess_exess_inputs_isomers_31920-31939_topology_9.json
************************************************************
**************** Running topology 11 of 20 *****************
************************************************************

************************************************************
******** Beginning RI-REVDSD-PBEP86-D4(NOFC) energy ********
************************************************************

Created 2835498 / 16064064 significant shell pairs
Created 1889923 / 10419984 significant shell pairs
Total number of grid points: 686938 (10102 per atom)
Total number of grid points: 687119 (10104 per atom)
Octree generated 452 batches
Total number of grid points: 687387 (10108 per atom)
Total number of grid points: 686436 (10094 per atom)
Octree generated 447 batches
Octree generated 446 batches
Octree generated 452 batches
Creating 452 batches. Average size: 1294, max size: 2046
Batching took 0.349710 seconds (33.49 MB)
Creating 447 batches. Average size: 1312, max size: 2047
Batching took 0.340208 seconds (33 MB)
Creating 446 batches. Average size: 1319, max size: 2048
Batching took 0.354338 seconds (32.92 MB)
Creating 452 batches. Average size: 1295, max size: 2045
Batching took 0.355230 seconds (33.29 MB)
One electron integrals and orthogonalizer took 0.249549s
Created 1889923 / 10419984 significant shell pairs
3C integrals and B formation took 8.282936s
Iteration |      Energy      |  DIIS Metric   | Fock Time (s) | DIIS Time (s)
----------+------------------+----------------+---------------+--------------
    1     | -1702.2789068645 |   2.5605e+03   |   13.3270     |    0.1542
    2     | -1684.0575331682 |   4.0946e+00   |    2.4167     |    0.1579
    3     | -1684.6891370722 |   1.2241e+00   |    2.4164     |    0.1610
    4     | -1684.8296262367 |   2.8132e-01   |    2.4161     |    0.1641
    5     | -1684.8689592579 |   4.0575e-02   |    2.4166     |    0.1673
    6     | -1684.8749158601 |   2.9003e-03   |    2.4125     |    0.1704
    7     | -1684.8753650682 |   7.6026e-04   |    2.4080     |    0.1736
    8     | -1684.8754905555 |   7.5238e-05   |    2.4194     |    0.1767
    9     | -1684.8755059002 |   1.2069e-05   |    2.4137     |    0.1768
   10     | -1684.8755080905 |   9.0597e-07   |    2.4162     |    0.1767
   11     | -1684.8755082839 |   2.2704e-07   |    2.4173     |    0.1767
   12     | -1684.8755083399 |   3.0704e-08   |    2.4142     |    0.1768
   13     | -1684.8755083550 |   1.1371e-08   |    2.4187     |    0.1766
   14     | -1684.8755083595 |   1.6713e-09   |    2.4135     |    0.1767
   15     | -1684.8755083602 |   5.7340e-10   |    2.4161     |    0.1767
   16     | -1684.8755083604 |   1.1163e-10   |    2.4082     |    0.1767
   17     | -1684.8755083604 |   3.1477e-11   |    2.4188     |    0.1767
=======================================================
         REVDSD-PBEP86-D4(NOFC) Energy Results         
=======================================================
E REVDSD-PBEP86-D4(NOFC): -1684.87550836
Nuclear Repulsion Energy: 4357.17958673
Electronic Energy:        -5964.46936421
XC Energy:                -77.585731
Converged:                1
# of SCF iterations:      17
SCF Time:                 64.329s
************************************************************
***************** Beginning RI-MP2 energy ******************
************************************************************

Created 1889923 / 10419984 significant shell pairs
=======================================================
                 RI-MP2 Energy Results                 
=======================================================
E OS:  -7.02015038972
E SS:  -2.32185843474
E MP2: -9.34200882446
Time:  32.642s

=======================================================
            Individual Calculation Summary             
=======================================================
HF Energy: -1684.8755083604419269
MP2 OS Energy: -4.1973479180138922
MP2 SS Energy: -0.1325781166236571
MP2 Total Energy: -4.3299260346375492
MP2 Corrected Energy: -1689.2054343950794646
=======================================================


Topology 10 time: 97.679889 s, performance: SP: 0 FLOP/s, DP: 41.92 TFLOP/s
JSON file written to: json_logs/global_u2_r_ryans_dhdft_inputs_exess_exess_inputs_isomers_31920-31939_topology_10.json
************************************************************
**************** Running topology 12 of 20 *****************
************************************************************

************************************************************
******** Beginning RI-REVDSD-PBEP86-D4(NOFC) energy ********
************************************************************

Created 2822159 / 16064064 significant shell pairs
Created 1881379 / 10419984 significant shell pairs
Total number of grid points: 686914 (10101 per atom)
Total number of grid points: 687278 (10107 per atom)
Total number of grid points: 686401 (10094 per atom)
Total number of grid points: 687287 (10107 per atom)
Octree generated 451 batches
Octree generated 447 batches
Octree generated 443 batches
Octree generated 446 batches
Creating 447 batches. Average size: 1318, max size: 2047
Batching took 0.335948 seconds (33.05 MB)
Creating 451 batches. Average size: 1298, max size: 2039
Batching took 0.355854 seconds (33.41 MB)
Creating 443 batches. Average size: 1322, max size: 2046
Batching took 0.347047 seconds (32.66 MB)
Creating 446 batches. Average size: 1311, max size: 2048
Batching took 0.345861 seconds (32.96 MB)
One electron integrals and orthogonalizer took 0.254471s
Created 1881379 / 10419984 significant shell pairs
3C integrals and B formation took 8.132000s
Iteration |      Energy      |  DIIS Metric   | Fock Time (s) | DIIS Time (s)
----------+------------------+----------------+---------------+--------------
    1     | -1702.1647549824 |   2.5416e+03   |   13.3301     |    0.1560
    2     | -1684.0761178381 |   3.9443e+00   |    2.4086     |    0.1598
    3     | -1684.7432630376 |   8.7626e-01   |    2.4090     |    0.1628
    4     | -1684.8522267411 |   1.9311e-01   |    2.4078     |    0.1658
    5     | -1684.8793229296 |   4.0212e-02   |    2.4103     |    0.1693
    6     | -1684.8854260768 |   2.3156e-03   |    2.4122     |    0.1723
    7     | -1684.8858210267 |   5.4509e-04   |    2.4076     |    0.1754
    8     | -1684.8859125377 |   6.3808e-05   |    2.4087     |    0.1785
    9     | -1684.8859245698 |   8.7500e-06   |    2.4046     |    0.1786
   10     | -1684.8859260285 |   5.1639e-07   |    2.4090     |    0.1785
   11     | -1684.8859261381 |   1.4408e-07   |    2.4095     |    0.1785
   12     | -1684.8859261675 |   1.6230e-08   |    2.4072     |    0.1785
   13     | -1684.8859261746 |   4.9778e-09   |    2.4111     |    0.1785
   14     | -1684.8859261763 |   8.7641e-10   |    2.4119     |    0.1786
   15     | -1684.8859261766 |   2.5247e-10   |    2.4069     |    0.1785
   16     | -1684.8859261767 |   5.9788e-11   |    2.4109     |    0.1784
=======================================================
         REVDSD-PBEP86-D4(NOFC) Energy Results         
=======================================================
E REVDSD-PBEP86-D4(NOFC): -1684.88592618
Nuclear Repulsion Energy: 4344.94200764
Electronic Energy:        -5952.24243625
XC Energy:                -77.585498
Converged:                1
# of SCF iterations:      16
SCF Time:                 61.502s
************************************************************
***************** Beginning RI-MP2 energy ******************
************************************************************

Created 1881379 / 10419984 significant shell pairs
=======================================================
                 RI-MP2 Energy Results                 
=======================================================
E OS:  -7.01622470848
E SS:  -2.31940186355
E MP2: -9.33562657203
Time:  32.529s

=======================================================
            Individual Calculation Summary             
=======================================================
HF Energy: -1684.8859261766849613
MP2 OS Energy: -4.1950007532024332
MP2 SS Energy: -0.1324378464086262
MP2 Total Energy: -4.3274385996110594
MP2 Corrected Energy: -1689.2133647762959754
=======================================================


Topology 11 time: 94.745232 s, performance: SP: 0 FLOP/s, DP: 42.58 TFLOP/s
JSON file written to: json_logs/global_u2_r_ryans_dhdft_inputs_exess_exess_inputs_isomers_31920-31939_topology_11.json
************************************************************
**************** Running topology 13 of 20 *****************
************************************************************

************************************************************
******** Beginning RI-REVDSD-PBEP86-D4(NOFC) energy ********
************************************************************

Created 2775736 / 16064064 significant shell pairs
Created 1847058 / 10419984 significant shell pairs
Total number of grid points: 687173 (10105 per atom)
Total number of grid points: 687096 (10104 per atom)
Total number of grid points: 686788 (10099 per atom)
Octree generated 447 batches
Octree generated 448 batches
Total number of grid points: 686823 (10100 per atom)
Octree generated 454 batches
Octree generated 455 batches
Creating 448 batches. Average size: 1308, max size: 2048
Batching took 0.333526 seconds (32.81 MB)
Creating 447 batches. Average size: 1312, max size: 2048
Batching took 0.354535 seconds (32.9 MB)
Creating 454 batches. Average size: 1291, max size: 2046
Batching took 0.360492 seconds (33.25 MB)
Creating 455 batches. Average size: 1285, max size: 2043
Batching took 0.356994 seconds (33.46 MB)
One electron integrals and orthogonalizer took 0.255841s
Created 1847058 / 10419984 significant shell pairs
3C integrals and B formation took 7.848219s
Iteration |      Energy      |  DIIS Metric   | Fock Time (s) | DIIS Time (s)
----------+------------------+----------------+---------------+--------------
    1     | -1699.6405632886 |   2.4207e+03   |   13.2967     |    0.1558
    2     | -1683.9982883178 |   4.8767e+00   |    2.3935     |    0.1598
    3     | -1684.6928523798 |   1.2344e+00   |    2.3993     |    0.1630
    4     | -1684.8450903239 |   1.8682e-01   |    2.3930     |    0.1657
    5     | -1684.8694610475 |   4.0121e-02   |    2.4045     |    0.1690
    6     | -1684.8751975736 |   2.0574e-03   |    2.3948     |    0.1721
    7     | -1684.8754994661 |   3.6780e-04   |    2.3962     |    0.1755
    8     | -1684.8755625676 |   3.2283e-05   |    2.3984     |    0.1785
    9     | -1684.8755711098 |   8.5307e-06   |    2.4200     |    0.1786
   10     | -1684.8755731308 |   6.4614e-07   |    2.4048     |    0.1785
   11     | -1684.8755732999 |   1.7135e-07   |    2.3929     |    0.1787
   12     | -1684.8755733366 |   1.3938e-08   |    2.3917     |    0.1786
   13     | -1684.8755733422 |   4.8237e-09   |    2.3951     |    0.1787
   14     | -1684.8755733437 |   6.3251e-10   |    2.3976     |    0.1784
   15     | -1684.8755733440 |   1.7186e-10   |    2.4006     |    0.1785
   16     | -1684.8755733441 |   5.4792e-11   |    2.3971     |    0.1782
=======================================================
         REVDSD-PBEP86-D4(NOFC) Energy Results         
=======================================================
E REVDSD-PBEP86-D4(NOFC): -1684.87557334
Nuclear Repulsion Energy: 4273.30711635
Electronic Energy:        -5880.59936334
XC Energy:                -77.583326
Converged:                1
# of SCF iterations:      16
SCF Time:                 61.056s
************************************************************
***************** Beginning RI-MP2 energy ******************
************************************************************

Created 1847058 / 10419984 significant shell pairs
