------------------------------------------------------------------------------

    * Giuseppe Barca         * Hamish Brown           * Jorge Galvez-Vallejo
    * Andrew Gilbert         * Min Htoo               * Fazeleh Kazemian    
    * Sean Laguna            * Jack Miller            * Elise Palethorpe    
    * Oliver Pulsford        * Ross Pure              * Christopher Seidl   
    * Dylan Silke            * Joshua Singla          * Calum Snowdon       
    * Ryan Stocks            * Ryan Swart             * Fiona Yu            


                 _..--+~/@-~--.      _____  __  __  _____   ____    ____
             _-=~      (  .   "}    | ____| \ \/ / | ____| / ___|  / ___|
          _-~     _.--=.\ \""""     |  _|    \  /  |  _|   \___ \  \___ \
        _~      _-       \ \_\      | |___   /  \  | |___   ___) |  ___) |
       =      _=          '--'      |_____| /_/\_\ |_____| |____/  |____/
      '      =
     :      :     ____            EXtreme-scale Electronic Structure System
___ |      ;                               Enjoy the power of GPUs!
    ;       ;                            Gordon Bell Award Winner 2024
  ___=       \ ___ __     __..-...__
     :        =_     _.-~~          ~~--.__
_____ \         ~-+-~                   ___~=_______
       == ...______ __ ___ _--~~--_
  

------------------------------------------------------------------------------

Commit no. used aedfa7ed9d5dfb1d6a4530fc669e9d390dc3eedd
Start of Calculation Local time: 2025-10-20 01:37:47
Start of Calculation UTC time:   2025-10-20 08:37:47
├── Calculation params
│   ├── Title: /global/u2/r/ryans/dhdft/inputs/exess/exess_inputs/isomers_31180-31199
│   ├── Driver: Energy
│   ├── Model
│   │   ├── Theory level: KS DFT
│   │   ├── Spin configuration: Restricted
│   │   ├── Primary basis: def2-QZVPP
│   │   ├── Auxiliary basis: def2-QZVPP-RIFIT
│   │   ├── Force cartesian basis sets: False
│   │   ├── Standard orientation: None
│   ├── Topologies
│   │   ├── Number of topologies: 20
│   ├── Keywords
│   │   ├── SCF keywords
│   │   │   ├── Max iterations: 50
│   │   │   ├── Batch size: 2560
│   │   │   ├── DIIS size: 8
│   │   │   ├── Convergence threshold: 1.000e-10
│   │   │   ├── Use guess fallback: False
│   │   │   ├── Convergence metric: DIIS
│   │   │   ├── Density threshold: 1.000e-10
│   │   │   ├── Gradient screening threshold: 1.000e-10
│   │   │   ├── Allow crap scf: False
│   │   │   ├── Fock build type: RI
│   │   │   ├── Group shared exponents: False
│   │   │   ├── Store RI B tensor on host: False
│   │   │   ├── Compress B tensor shell pairs: True
│   │   ├── KS
│   │   │   ├── Functional: REVDSD-PBEP86-D4(NOFC)
│   │   │   ├── Method: BatchDense
│   │   │   ├── Hybrid: True
│   │   │   ├── Grid
│   │   │   │   ├── RadialQuad: MuraKnowles
│   │   │   │   ├── PruningScheme: ROBUST
│   │   │   │   ├── Consider weight zero: 1.000e-15
│   │   │   │   ├── Octree
│   │   │   │   │   ├── Max size: 2048
│   │   │   │   │   ├── Max depth: 18446744073709551615
│   │   │   │   │   ├── Max distance: -2147483648
│   │   │   │   │   ├── Combine small children: Some(1)
│   │   │   │   ├── GridDefaults: ULTRAFINE
│   │   │   ├── Use C optimization: False
│   │   │   ├── Double precision threshold: 1.000e-10
│   │   │   ├── Batches per batch: 30
│   │   ├── RTAT keywords
│   │   │   ├── Enabled: True
│   │   ├── Debug keywords
│   │   │   ├── Dry run: False
│   │   │   ├── Skip calcs: False
│   │   │   ├── Subfragment XYZ debug: False
│   │   ├── Export Keywords
│   │   │   ├── Not exporting any matrices
│   │   ├── Guess keywords
│   │   │   ├── Superposition of monomer densities: False
│   │   │   ├── Superposition of subfragment densities: False
│   │   │   ├── Basis set projection: False
│   │   ├── Boundary keywords
│   │   │   ├── X
│   │   │   │   ├── Type: None
│   │   │   ├── Y
│   │   │   │   ├── Type: None
│   │   │   ├── Z
│   │   │   │   ├── Type: None
│   │   ├── Logging
│   │   │   ├── Restricted logs visible
│   │   │   ├── Console logging
│   │   │   │   ├── Level: INFO
│   │   │   │   ├── Use log level colors: False
│   │   ├── Integrals Keywords
│   │   │   ├── Scheduler: Callback
│   │   │   ├── Number of streams: 4
│   ├── System
│   │   ├── Max GPU Memory: 54 GB
│   │   ├── Oversubscribe GPUs: False
│   │   ├── Teams per node: 1

************************************************************
****** Doing a batched calculation with 20 topologies ******
************************************************************

************************************************************
***************** Running topology 1 of 20 *****************
************************************************************

************************************************************
******** Beginning RI-REVDSD-PBEP86-D4(NOFC) energy ********
************************************************************

Created 3168000 / 16064064 significant shell pairs
Created 2121611 / 10419984 significant shell pairs
Total number of grid points: 687092 (10104 per atom)
Total number of grid points: 686846 (10100 per atom)
Total number of grid points: 686494 (10095 per atom)
Total number of grid points: 687448 (10109 per atom)
Octree generated 442 batches
Octree generated 447 batches
Octree generated 444 batches
Octree generated 439 batches
Creating 442 batches. Average size: 1326, max size: 2048
Batching took 0.358509 seconds (33.92 MB)
Creating 439 batches. Average size: 1329, max size: 2046
Batching took 0.356954 seconds (33.82 MB)
Creating 444 batches. Average size: 1315, max size: 2048
Batching took 0.360578 seconds (34.21 MB)
Creating 447 batches. Average size: 1300, max size: 2048
Batching took 0.365176 seconds (34.41 MB)
One electron integrals and orthogonalizer took 0.649198s
Created 2121611 / 10419984 significant shell pairs
3C integrals and B formation took 12.942291s
Iteration |      Energy      |  DIIS Metric   | Fock Time (s) | DIIS Time (s)
----------+------------------+----------------+---------------+--------------
    1     | -1702.0272680808 |   2.5687e+03   |   16.4661     |    0.2194
    2     | -1683.9900505566 |   4.4453e+00   |    2.5369     |    0.1582
    3     | -1684.6420117996 |   1.4440e+00   |    2.5124     |    0.1615
    4     | -1684.8063737670 |   3.0022e-01   |    2.5113     |    0.1646
    5     | -1684.8454002633 |   6.4633e-02   |    2.5182     |    0.1673
    6     | -1684.8547707434 |   3.9470e-03   |    2.5085     |    0.1704
    7     | -1684.8553753838 |   8.4727e-04   |    2.5079     |    0.1736
    8     | -1684.8555219839 |   6.4135e-05   |    2.5066     |    0.1767
    9     | -1684.8555361563 |   1.3811e-05   |    2.5049     |    0.1776
   10     | -1684.8555384351 |   1.2333e-06   |    2.5079     |    0.1777
   11     | -1684.8555386680 |   2.7688e-07   |    2.5019     |    0.1784
   12     | -1684.8555387300 |   4.2734e-08   |    2.5072     |    0.1766
   13     | -1684.8555387478 |   1.4917e-08   |    2.5048     |    0.1766
   14     | -1684.8555387538 |   3.8044e-09   |    2.5072     |    0.1766
   15     | -1684.8555387552 |   1.0315e-09   |    2.5059     |    0.1767
   16     | -1684.8555387556 |   2.6643e-10   |    2.5166     |    0.1768
   17     | -1684.8555387557 |   7.7354e-11   |    2.5069     |    0.1767
=======================================================
         REVDSD-PBEP86-D4(NOFC) Energy Results         
=======================================================
E REVDSD-PBEP86-D4(NOFC): -1684.85553876
Nuclear Repulsion Energy: 4675.35738462
Electronic Energy:        -6282.61925116
XC Energy:                -77.593672
Converged:                1
# of SCF iterations:      17
SCF Time:                 74.178s
************************************************************
***************** Beginning RI-MP2 energy ******************
************************************************************

Created 2121611 / 10419984 significant shell pairs
=======================================================
                 RI-MP2 Energy Results                 
=======================================================
E OS:  -7.03195730201
E SS:  -2.33401595214
E MP2: -9.36597325415
Time:  33.216s

=======================================================
            Individual Calculation Summary             
=======================================================
HF Energy: -1684.8555387556712049
MP2 OS Energy: -4.2044072708712967
MP2 SS Energy: -0.1332723108674343
MP2 Total Energy: -4.3376795817387306
MP2 Corrected Energy: -1689.1932183374099168
=======================================================


Topology 0 time: 130.657913 s, performance: SP: 0 FLOP/s, DP: 31.92 TFLOP/s
JSON file written to: json_logs/global_u2_r_ryans_dhdft_inputs_exess_exess_inputs_isomers_31180-31199_topology_0.json
************************************************************
***************** Running topology 2 of 20 *****************
************************************************************

************************************************************
******** Beginning RI-REVDSD-PBEP86-D4(NOFC) energy ********
************************************************************

Created 3141612 / 16064064 significant shell pairs
Created 2105602 / 10419984 significant shell pairs
Total number of grid points: 686425 (10094 per atom)
Total number of grid points: 687199 (10105 per atom)
Total number of grid points: 687175 (10105 per atom)
Total number of grid points: 687081 (10104 per atom)
Octree generated 449 batches
Octree generated 443 batches
Octree generated 444 batches
Octree generated 442 batches
Creating 449 batches. Average size: 1301, max size: 2045
Batching took 0.359465 seconds (34.37 MB)
Creating 443 batches. Average size: 1312, max size: 2046
Batching took 0.359725 seconds (33.98 MB)
Creating 444 batches. Average size: 1320, max size: 2048
Batching took 0.358020 seconds (33.92 MB)
Creating 442 batches. Average size: 1323, max size: 2047
Batching took 0.362772 seconds (34.15 MB)
One electron integrals and orthogonalizer took 0.220475s
Created 2105602 / 10419984 significant shell pairs
3C integrals and B formation took 10.107324s
Iteration |      Energy      |  DIIS Metric   | Fock Time (s) | DIIS Time (s)
----------+------------------+----------------+---------------+--------------
    1     | -1701.4992216908 |   2.5515e+03   |   13.3582     |    0.1568
    2     | -1684.0477344059 |   4.2289e+00   |    2.5184     |    0.1603
    3     | -1684.6750930599 |   1.2675e+00   |    2.5010     |    0.1636
    4     | -1684.8143351175 |   3.0106e-01   |    2.4964     |    0.1666
    5     | -1684.8517694732 |   6.4178e-02   |    2.5158     |    0.1698
    6     | -1684.8608490028 |   3.2405e-03   |    2.5173     |    0.1732
    7     | -1684.8613342830 |   7.1108e-04   |    2.5057     |    0.1759
    8     | -1684.8614490575 |   6.8188e-05   |    2.4987     |    0.1783
    9     | -1684.8614632150 |   1.3897e-05   |    2.4958     |    0.1784
   10     | -1684.8614657564 |   1.1865e-06   |    2.4983     |    0.1784
   11     | -1684.8614659697 |   1.8687e-07   |    2.5013     |    0.1783
   12     | -1684.8614660109 |   2.4607e-08   |    2.4968     |    0.1782
   13     | -1684.8614660192 |   7.4916e-09   |    2.4957     |    0.1783
   14     | -1684.8614660218 |   2.0515e-09   |    2.4968     |    0.1783
   15     | -1684.8614660224 |   6.1192e-10   |    2.4992     |    0.1784
   16     | -1684.8614660226 |   1.6430e-10   |    2.4974     |    0.1784
   17     | -1684.8614660227 |   4.1812e-11   |    2.4981     |    0.1785
=======================================================
         REVDSD-PBEP86-D4(NOFC) Energy Results         
=======================================================
E REVDSD-PBEP86-D4(NOFC): -1684.86146602
Nuclear Repulsion Energy: 4663.56199199
Electronic Energy:        -6270.83062374
XC Energy:                -77.592834
Converged:                1
# of SCF iterations:      17
SCF Time:                 67.607s
************************************************************
***************** Beginning RI-MP2 energy ******************
************************************************************

Created 2105602 / 10419984 significant shell pairs
=======================================================
                 RI-MP2 Energy Results                 
=======================================================
E OS:  -7.0305775032
E SS:  -2.33285603223
E MP2: -9.36343353543
Time:  32.758s

=======================================================
            Individual Calculation Summary             
=======================================================
HF Energy: -1684.8614660226710384
MP2 OS Energy: -4.2035822891641930
MP2 SS Energy: -0.1332060794401498
MP2 Total Energy: -4.3367883686043429
MP2 Corrected Energy: -1689.1982543912754409
=======================================================


Topology 1 time: 101.145143 s, performance: SP: 0 FLOP/s, DP: 41.18 TFLOP/s
JSON file written to: json_logs/global_u2_r_ryans_dhdft_inputs_exess_exess_inputs_isomers_31180-31199_topology_1.json
************************************************************
***************** Running topology 3 of 20 *****************
************************************************************

************************************************************
******** Beginning RI-REVDSD-PBEP86-D4(NOFC) energy ********
************************************************************

Created 3108310 / 16064064 significant shell pairs
Created 2081185 / 10419984 significant shell pairs
Total number of grid points: 686880 (10101 per atom)
Total number of grid points: 686614 (10097 per atom)
Total number of grid points: 687129 (10104 per atom)
Total number of grid points: 687257 (10106 per atom)
Octree generated 439 batches
Octree generated 446 batches
Octree generated 435 batches
Octree generated 443 batches
Creating 439 batches. Average size: 1328, max size: 2044
Batching took 0.379534 seconds (33.64 MB)
Creating 446 batches. Average size: 1306, max size: 2039
Batching took 0.382663 seconds (34.07 MB)
Creating 435 batches. Average size: 1343, max size: 2028
Batching took 0.376666 seconds (33.34 MB)
Creating 443 batches. Average size: 1323, max size: 2043
Batching took 0.377460 seconds (33.82 MB)
One electron integrals and orthogonalizer took 0.230775s
Created 2081185 / 10419984 significant shell pairs
3C integrals and B formation took 10.345149s
Iteration |      Energy      |  DIIS Metric   | Fock Time (s) | DIIS Time (s)
----------+------------------+----------------+---------------+--------------
    1     | -1702.3751285971 |   2.5906e+03   |   13.3592     |    0.1552
    2     | -1684.0155902007 |   4.2781e+00   |    2.5120     |    0.1587
    3     | -1684.6055968025 |   1.6757e+00   |    2.4803     |    0.1620
    4     | -1684.7868686000 |   4.2977e-01   |    2.4820     |    0.1651
    5     | -1684.8461873089 |   6.8777e-02   |    2.4888     |    0.1682
    6     | -1684.8562960369 |   3.8425e-03   |    2.4862     |    0.1714
    7     | -1684.8568974486 |   8.3596e-04   |    2.4886     |    0.1744
    8     | -1684.8570458735 |   8.0467e-05   |    2.4867     |    0.1767
    9     | -1684.8570643140 |   1.8729e-05   |    2.4873     |    0.1768
   10     | -1684.8570679801 |   1.9528e-06   |    2.4813     |    0.1767
   11     | -1684.8570684990 |   4.3813e-07   |    2.4816     |    0.1769
   12     | -1684.8570686588 |   9.3893e-08   |    2.4837     |    0.1765
   13     | -1684.8570687116 |   3.3904e-08   |    2.4812     |    0.1768
   14     | -1684.8570687248 |   5.6143e-09   |    2.4821     |    0.1766
   15     | -1684.8570687267 |   1.6534e-09   |    2.4913     |    0.1769
   16     | -1684.8570687271 |   3.8754e-10   |    2.4814     |    0.1768
   17     | -1684.8570687273 |   8.1228e-11   |    2.4874     |    0.1767
=======================================================
         REVDSD-PBEP86-D4(NOFC) Energy Results         
=======================================================
E REVDSD-PBEP86-D4(NOFC): -1684.85706873
Nuclear Repulsion Energy: 4627.94258726
Electronic Energy:        -6235.20819249
XC Energy:                -77.591464
Converged:                1
# of SCF iterations:      17
SCF Time:                 67.573s
************************************************************
***************** Beginning RI-MP2 energy ******************
************************************************************

Created 2081185 / 10419984 significant shell pairs
=======================================================
                 RI-MP2 Energy Results                 
=======================================================
E OS:  -7.03080600715
E SS:  -2.33248560976
E MP2: -9.36329161691
Time:  32.624s

=======================================================
            Individual Calculation Summary             
=======================================================
HF Energy: -1684.8570687272672330
MP2 OS Energy: -4.2037189116738523
MP2 SS Energy: -0.1331849283171791
MP2 Total Energy: -4.3369038399910309
MP2 Corrected Energy: -1689.1939725672582426
=======================================================


Topology 2 time: 101.066461 s, performance: SP: 0 FLOP/s, DP: 41.08 TFLOP/s
JSON file written to: json_logs/global_u2_r_ryans_dhdft_inputs_exess_exess_inputs_isomers_31180-31199_topology_2.json
************************************************************
***************** Running topology 4 of 20 *****************
************************************************************

************************************************************
******** Beginning RI-REVDSD-PBEP86-D4(NOFC) energy ********
************************************************************

Created 3225344 / 16064064 significant shell pairs
Created 2165759 / 10419984 significant shell pairs
Total number of grid points: 685967 (10087 per atom)
Total number of grid points: 686487 (10095 per atom)
Total number of grid points: 688277 (10121 per atom)
Total number of grid points: 687149 (10105 per atom)
Octree generated 450 batches
Octree generated 441 batches
Octree generated 452 batches
Octree generated 445 batches
Creating 450 batches. Average size: 1297, max size: 2046
Batching took 0.384244 seconds (34.88 MB)
Creating 441 batches. Average size: 1319, max size: 2042
Batching took 0.381307 seconds (34.33 MB)
Creating 452 batches. Average size: 1293, max size: 2043
Batching took 0.383488 seconds (34.89 MB)
Creating 445 batches. Average size: 1312, max size: 2048
Batching took 0.377829 seconds (34.47 MB)
One electron integrals and orthogonalizer took 0.237010s
Created 2165759 / 10419984 significant shell pairs
3C integrals and B formation took 10.155753s
Iteration |      Energy      |  DIIS Metric   | Fock Time (s) | DIIS Time (s)
----------+------------------+----------------+---------------+--------------
    1     | -1701.4704866789 |   2.5378e+03   |   13.4749     |    0.1557
    2     | -1684.0297112467 |   4.2624e+00   |    2.5698     |    0.1593
    3     | -1684.6894564105 |   1.0918e+00   |    2.5428     |    0.1626
    4     | -1684.8175518937 |   2.5155e-01   |    2.5397     |    0.1657
    5     | -1684.8517498480 |   4.9834e-02   |    2.5417     |    0.1689
    6     | -1684.8591003800 |   3.1276e-03   |    2.5379     |    0.1721
    7     | -1684.8595796851 |   6.0062e-04   |    2.5431     |    0.1753
    8     | -1684.8596895519 |   6.4464e-05   |    2.5428     |    0.1767
    9     | -1684.8597037895 |   1.2641e-05   |    2.5345     |    0.1767
   10     | -1684.8597059640 |   1.0012e-06   |    2.5430     |    0.1769
   11     | -1684.8597061682 |   2.6986e-07   |    2.5402     |    0.1768
   12     | -1684.8597062280 |   4.1278e-08   |    2.5375     |    0.1767
   13     | -1684.8597062443 |   1.6143e-08   |    2.5353     |    0.1767
   14     | -1684.8597062504 |   3.3308e-09   |    2.5391     |    0.1767
   15     | -1684.8597062519 |   9.1728e-10   |    2.5400     |    0.1766
   16     | -1684.8597062522 |   1.8009e-10   |    2.5357     |    0.1765
   17     | -1684.8597062523 |   4.8007e-11   |    2.5378     |    0.1766
=======================================================
         REVDSD-PBEP86-D4(NOFC) Energy Results         
=======================================================
E REVDSD-PBEP86-D4(NOFC): -1684.85970625
Nuclear Repulsion Energy: 4729.52510022
Electronic Energy:        -6336.79266049
XC Energy:                -77.592146
Converged:                1
# of SCF iterations:      17
SCF Time:                 68.452s
************************************************************
***************** Beginning RI-MP2 energy ******************
************************************************************

Created 2165759 / 10419984 significant shell pairs
=======================================================
                 RI-MP2 Energy Results                 
=======================================================
E OS:  -7.03175907848
E SS:  -2.33329974499
E MP2: -9.36505882347
Time:  32.956s

=======================================================
            Individual Calculation Summary             
=======================================================
HF Energy: -1684.8597062522658234
MP2 OS Energy: -4.2042887530231923
MP2 SS Energy: -0.1332314154387832
MP2 Total Energy: -4.3375201684619755
MP2 Corrected Energy: -1689.1972264207277021
=======================================================


Topology 3 time: 102.176300 s, performance: SP: 0 FLOP/s, DP: 40.89 TFLOP/s
JSON file written to: json_logs/global_u2_r_ryans_dhdft_inputs_exess_exess_inputs_isomers_31180-31199_topology_3.json
************************************************************
***************** Running topology 5 of 20 *****************
************************************************************

************************************************************
******** Beginning RI-REVDSD-PBEP86-D4(NOFC) energy ********
************************************************************

Created 3179383 / 16064064 significant shell pairs
Created 2131950 / 10419984 significant shell pairs
Total number of grid points: 687149 (10105 per atom)
Total number of grid points: 686235 (10091 per atom)
Total number of grid points: 686915 (10101 per atom)
Octree generated 438 batches
Octree generated 457 batches
Octree generated 440 batches
Total number of grid points: 687581 (10111 per atom)
Octree generated 436 batches
Creating 438 batches. Average size: 1326, max size: 2044
Batching took 0.360875 seconds (33.8 MB)
Creating 440 batches. Average size: 1329, max size: 2045
Batching took 0.367414 seconds (33.96 MB)
Creating 457 batches. Average size: 1279, max size: 2048
Batching took 0.377172 seconds (35.38 MB)
Creating 436 batches. Average size: 1341, max size: 2037
Batching took 0.362799 seconds (33.94 MB)
One electron integrals and orthogonalizer took 0.241179s
Created 2131950 / 10419984 significant shell pairs
3C integrals and B formation took 9.659801s
Iteration |      Energy      |  DIIS Metric   | Fock Time (s) | DIIS Time (s)
----------+------------------+----------------+---------------+--------------
    1     | -1702.1286562885 |   2.5780e+03   |   13.4241     |    0.1545
    2     | -1684.0546456306 |   4.0270e+00   |    2.5771     |    0.1578
    3     | -1684.6815894021 |   1.1715e+00   |    2.5500     |    0.1613
    4     | -1684.8061006010 |   3.3209e-01   |    2.5476     |    0.1641
    5     | -1684.8495296760 |   6.2210e-02   |    2.5506     |    0.1673
    6     | -1684.8587542204 |   2.8214e-03   |    2.5517     |    0.1706
    7     | -1684.8592142578 |   6.8015e-04   |    2.5535     |    0.1738
    8     | -1684.8593314965 |   7.9026e-05   |    2.5506     |    0.1769
    9     | -1684.8593475568 |   1.4977e-05   |    2.5501     |    0.1770
   10     | -1684.8593503480 |   1.0068e-06   |    2.5534     |    0.1768
   11     | -1684.8593506398 |   3.0530e-07   |    2.5505     |    0.1768
   12     | -1684.8593507377 |   7.6102e-08   |    2.5540     |    0.1769
   13     | -1684.8593507784 |   2.0793e-08   |    2.5502     |    0.1770
   14     | -1684.8593507872 |   3.6298e-09   |    2.5488     |    0.1770
   15     | -1684.8593507886 |   8.4634e-10   |    2.5528     |    0.1767
   16     | -1684.8593507889 |   2.4082e-10   |    2.5478     |    0.1768
   17     | -1684.8593507889 |   4.5349e-11   |    2.5516     |    0.1769
=======================================================
         REVDSD-PBEP86-D4(NOFC) Energy Results         
=======================================================
E REVDSD-PBEP86-D4(NOFC): -1684.85935079
Nuclear Repulsion Energy: 4691.05491876
Electronic Energy:        -6298.32101326
XC Energy:                -77.593256
Converged:                1
# of SCF iterations:      17
SCF Time:                 68.085s
************************************************************
***************** Beginning RI-MP2 energy ******************
************************************************************

Created 2131950 / 10419984 significant shell pairs
=======================================================
                 RI-MP2 Energy Results                 
=======================================================
E OS:  -7.03030941576
E SS:  -2.33286606148
E MP2: -9.36317547723
Time:  32.762s

=======================================================
            Individual Calculation Summary             
=======================================================
HF Energy: -1684.8593507889220291
MP2 OS Energy: -4.2034219996810886
MP2 SS Energy: -0.1332066521102616
MP2 Total Energy: -4.3366286517913499
MP2 Corrected Energy: -1689.1959794407134723
=======================================================


Topology 4 time: 101.617811 s, performance: SP: 0 FLOP/s, DP: 41.11 TFLOP/s
JSON file written to: json_logs/global_u2_r_ryans_dhdft_inputs_exess_exess_inputs_isomers_31180-31199_topology_4.json
************************************************************
***************** Running topology 6 of 20 *****************
************************************************************

************************************************************
******** Beginning RI-REVDSD-PBEP86-D4(NOFC) energy ********
************************************************************

Created 3160245 / 16064064 significant shell pairs
Created 2118324 / 10419984 significant shell pairs
Total number of grid points: 687036 (10103 per atom)
Total number of grid points: 687562 (10111 per atom)
Total number of grid points: 686489 (10095 per atom)
Total number of grid points: 686793 (10099 per atom)
Octree generated 440 batches
Octree generated 440 batches
Octree generated 450 batches
Octree generated 451 batches
Creating 440 batches. Average size: 1325, max size: 2048
Batching took 0.360305 seconds (34.15 MB)
Creating 440 batches. Average size: 1332, max size: 2044
Batching took 0.359327 seconds (33.8 MB)
Creating 450 batches. Average size: 1295, max size: 2041
Batching took 0.363462 seconds (34.8 MB)
Creating 451 batches. Average size: 1291, max size: 2043
Batching took 0.376188 seconds (35.01 MB)
One electron integrals and orthogonalizer took 0.245550s
Created 2118324 / 10419984 significant shell pairs
3C integrals and B formation took 9.857690s
Iteration |      Energy      |  DIIS Metric   | Fock Time (s) | DIIS Time (s)
----------+------------------+----------------+---------------+--------------
    1     | -1701.2989309970 |   2.5521e+03   |   13.4160     |    0.1560
    2     | -1684.1088845689 |   3.8821e+00   |    2.5258     |    0.1596
    3     | -1684.7178844314 |   9.1219e-01   |    2.5246     |    0.1626
    4     | -1684.8154317968 |   2.5407e-01   |    2.5254     |    0.1661
    5     | -1684.8465707991 |   4.9234e-02   |    2.5240     |    0.1690
    6     | -1684.8535100773 |   2.8943e-03   |    2.5256     |    0.1722
    7     | -1684.8539468977 |   4.7322e-04   |    2.5435     |    0.1757
    8     | -1684.8540251996 |   3.7144e-05   |    2.5280     |    0.1786
    9     | -1684.8540344820 |   8.9557e-06   |    2.5244     |    0.1785
   10     | -1684.8540362713 |   8.8521e-07   |    2.5259     |    0.1786
   11     | -1684.8540364413 |   2.5981e-07   |    2.5256     |    0.1785
   12     | -1684.8540364934 |   1.7165e-08   |    2.5234     |    0.1785
   13     | -1684.8540365005 |   6.5177e-09   |    2.5252     |    0.1783
   14     | -1684.8540365028 |   1.1374e-09   |    2.5303     |    0.1787
   15     | -1684.8540365033 |   4.7940e-10   |    2.5236     |    0.1786
   16     | -1684.8540365034 |   1.1476e-10   |    2.5456     |    0.1787
   17     | -1684.8540365034 |   2.1209e-11   |    2.5242     |    0.1783
=======================================================
         REVDSD-PBEP86-D4(NOFC) Energy Results         
=======================================================
E REVDSD-PBEP86-D4(NOFC): -1684.8540365
Nuclear Repulsion Energy: 4669.85760099
Electronic Energy:        -6277.12091918
XC Energy:                -77.590718
Converged:                1
# of SCF iterations:      17
SCF Time:                 67.851s
************************************************************
***************** Beginning RI-MP2 energy ******************
************************************************************

Created 2118324 / 10419984 significant shell pairs
=======================================================
                 RI-MP2 Energy Results                 
=======================================================
E OS:  -7.03256396559
E SS:  -2.33304903434
E MP2: -9.36561299993
Time:  32.77s

=======================================================
            Individual Calculation Summary             
=======================================================
HF Energy: -1684.8540365034177739
MP2 OS Energy: -4.2047699950266768
MP2 SS Energy: -0.1332170998609058
MP2 Total Energy: -4.3379870948875823
MP2 Corrected Energy: -1689.1920235983054681
=======================================================


Topology 5 time: 101.392254 s, performance: SP: 0 FLOP/s, DP: 41.14 TFLOP/s
JSON file written to: json_logs/global_u2_r_ryans_dhdft_inputs_exess_exess_inputs_isomers_31180-31199_topology_5.json
************************************************************
***************** Running topology 7 of 20 *****************
************************************************************

************************************************************
******** Beginning RI-REVDSD-PBEP86-D4(NOFC) energy ********
************************************************************

Created 3275097 / 16064064 significant shell pairs
Created 2193223 / 10419984 significant shell pairs
Total number of grid points: 686756 (10099 per atom)
Total number of grid points: 686826 (10100 per atom)
Total number of grid points: 686571 (10096 per atom)
Octree generated 452 batches
Total number of grid points: 687727 (10113 per atom)
Octree generated 450 batches
Octree generated 450 batches
Octree generated 446 batches
Creating 452 batches. Average size: 1291, max size: 2047
Batching took 0.381664 seconds (35.16 MB)
Creating 450 batches. Average size: 1298, max size: 2046
Batching took 0.379938 seconds (35.16 MB)
Creating 450 batches. Average size: 1292, max size: 2048
Batching took 0.384003 seconds (35.23 MB)
Creating 446 batches. Average size: 1305, max size: 2047
Batching took 0.379176 seconds (34.85 MB)
One electron integrals and orthogonalizer took 0.245383s
Created 2193223 / 10419984 significant shell pairs
3C integrals and B formation took 10.363173s
Iteration |      Energy      |  DIIS Metric   | Fock Time (s) | DIIS Time (s)
----------+------------------+----------------+---------------+--------------
    1     | -1701.9697718993 |   2.5793e+03   |   13.4792     |    0.1543
    2     | -1683.9841873937 |   4.5266e+00   |    2.6058     |    0.1580
    3     | -1684.6348349864 |   1.5440e+00   |    2.5864     |    0.1612
    4     | -1684.8029655594 |   3.5606e-01   |    2.5828     |    0.1641
    5     | -1684.8475153465 |   8.4980e-02   |    2.5826     |    0.1675
    6     | -1684.8599163252 |   5.2906e-03   |    2.5870     |    0.1707
    7     | -1684.8607302612 |   7.4447e-04   |    2.5774     |    0.1735
    8     | -1684.8608683146 |   7.9539e-05   |    2.5839     |    0.1769
    9     | -1684.8608832924 |   2.4152e-05   |    2.5791     |    0.1768
   10     | -1684.8608873151 |   1.4963e-06   |    2.5877     |    0.1767
   11     | -1684.8608876513 |   4.1512e-07   |    2.5865     |    0.1768
   12     | -1684.8608877588 |   6.6723e-08   |    2.5871     |    0.1767
   13     | -1684.8608877952 |   2.4826e-08   |    2.5890     |    0.1771
   14     | -1684.8608878046 |   4.9586e-09   |    2.5897     |    0.1768
   15     | -1684.8608878065 |   1.4222e-09   |    2.5909     |    0.1768
   16     | -1684.8608878068 |   3.0274e-10   |    2.5864     |    0.1768
   17     | -1684.8608878069 |   7.5678e-11   |    2.5918     |    0.1766
=======================================================
         REVDSD-PBEP86-D4(NOFC) Energy Results         
=======================================================
E REVDSD-PBEP86-D4(NOFC): -1684.86088781
Nuclear Repulsion Energy: 4756.68538424
Electronic Energy:        -6363.95050447
XC Energy:                -77.595768
Converged:                1
# of SCF iterations:      17
SCF Time:                 69.384s
************************************************************
***************** Beginning RI-MP2 energy ******************
************************************************************

Created 2193223 / 10419984 significant shell pairs
=======================================================
                 RI-MP2 Energy Results                 
=======================================================
E OS:  -7.0353626628
E SS:  -2.33728671896
E MP2: -9.37264938176
Time:  33.284s

=======================================================
            Individual Calculation Summary             
=======================================================
HF Energy: -1684.8608878068644117
MP2 OS Energy: -4.2064433360857532
MP2 SS Energy: -0.1334590716528919
MP2 Total Energy: -4.3399024077386450
MP2 Corrected Energy: -1689.2007902146031029
=======================================================


Topology 6 time: 103.464253 s, performance: SP: 0 FLOP/s, DP: 40.59 TFLOP/s
JSON file written to: json_logs/global_u2_r_ryans_dhdft_inputs_exess_exess_inputs_isomers_31180-31199_topology_6.json
************************************************************
***************** Running topology 8 of 20 *****************
************************************************************

************************************************************
******** Beginning RI-REVDSD-PBEP86-D4(NOFC) energy ********
************************************************************

Created 3278828 / 16064064 significant shell pairs
Created 2199912 / 10419984 significant shell pairs
Total number of grid points: 687002 (10102 per atom)
Total number of grid points: 687100 (10104 per atom)
Total number of grid points: 686645 (10097 per atom)
Total number of grid points: 687133 (10104 per atom)
Octree generated 446 batches
Octree generated 447 batches
Octree generated 442 batches
Octree generated 447 batches
Creating 446 batches. Average size: 1301, max size: 2046
Batching took 0.382415 seconds (34.98 MB)
Creating 447 batches. Average size: 1304, max size: 2048
Batching took 0.380516 seconds (35.03 MB)
Creating 442 batches. Average size: 1313, max size: 2045
Batching took 0.381019 seconds (34.61 MB)
Creating 447 batches. Average size: 1309, max size: 2048
Batching took 0.379647 seconds (35.02 MB)
One electron integrals and orthogonalizer took 0.250065s
Created 2199912 / 10419984 significant shell pairs
3C integrals and B formation took 10.360257s
Iteration |      Energy      |  DIIS Metric   | Fock Time (s) | DIIS Time (s)
----------+------------------+----------------+---------------+--------------
    1     | -1701.0268754006 |   2.5138e+03   |   13.4787     |    0.1544
    2     | -1684.0255850003 |   4.4320e+00   |    2.5633     |    0.1580
    3     | -1684.7019134002 |   1.1034e+00   |    2.5634     |    0.1612
    4     | -1684.8315511918 |   2.3716e-01   |    2.5610     |    0.1643
    5     | -1684.8631521256 |   4.9721e-02   |    2.5602     |    0.1673
    6     | -1684.8705935653 |   2.6120e-03   |    2.5625     |    0.1706
    7     | -1684.8710002090 |   5.2786e-04   |    2.5753     |    0.1738
    8     | -1684.8710948629 |   5.6276e-05   |    2.5588     |    0.1766
    9     | -1684.8711068319 |   1.2286e-05   |    2.5571     |    0.1768
   10     | -1684.8711088976 |   9.4698e-07   |    2.5669     |    0.1768
   11     | -1684.8711090728 |   2.4927e-07   |    2.5636     |    0.1768
   12     | -1684.8711091216 |   3.0333e-08   |    2.5744     |    0.1768
   13     | -1684.8711091321 |   1.0005e-08   |    2.5694     |    0.1768
   14     | -1684.8711091360 |   1.9220e-09   |    2.5967     |    0.1767
   15     | -1684.8711091368 |   6.9172e-10   |    2.5751     |    0.1768
   16     | -1684.8711091370 |   1.2982e-10   |    2.5743     |    0.1768
   17     | -1684.8711091371 |   3.5127e-11   |    2.5620     |    0.1770
=======================================================
         REVDSD-PBEP86-D4(NOFC) Energy Results         
=======================================================
E REVDSD-PBEP86-D4(NOFC): -1684.87110914
Nuclear Repulsion Energy: 4734.60953196
Electronic Energy:        -6341.8873119
XC Energy:                -77.593329
Converged:                1
# of SCF iterations:      17
SCF Time:                 69.082s
************************************************************
***************** Beginning RI-MP2 energy ******************
************************************************************

Created 2199912 / 10419984 significant shell pairs
=======================================================
                 RI-MP2 Energy Results                 
=======================================================
E OS:  -7.03135851691
E SS:  -2.33273944655
E MP2: -9.36409796346
Time:  33.166s

=======================================================
            Individual Calculation Summary             
=======================================================
HF Energy: -1684.8711091370569193
MP2 OS Energy: -4.2040492572602215
MP2 SS Energy: -0.1331994223979676
MP2 Total Energy: -4.3372486796581891
MP2 Corrected Energy: -1689.2083578167150790
=======================================================


Topology 7 time: 103.029151 s, performance: SP: 0 FLOP/s, DP: 40.8 TFLOP/s
JSON file written to: json_logs/global_u2_r_ryans_dhdft_inputs_exess_exess_inputs_isomers_31180-31199_topology_7.json
************************************************************
***************** Running topology 9 of 20 *****************
************************************************************

************************************************************
******** Beginning RI-REVDSD-PBEP86-D4(NOFC) energy ********
************************************************************

Created 3215504 / 16064064 significant shell pairs
Created 2157282 / 10419984 significant shell pairs
Total number of grid points: 686503 (10095 per atom)
Total number of grid points: 686635 (10097 per atom)
Total number of grid points: 686826 (10100 per atom)
Total number of grid points: 687916 (10116 per atom)
Octree generated 438 batches
Octree generated 443 batches
Octree generated 451 batches
Octree generated 448 batches
Creating 438 batches. Average size: 1329, max size: 2046
Batching took 0.358118 seconds (34.07 MB)
Creating 443 batches. Average size: 1311, max size: 2027
Batching took 0.371691 seconds (34.46 MB)
Creating 451 batches. Average size: 1295, max size: 2044
Batching took 0.369970 seconds (35.02 MB)
Creating 448 batches. Average size: 1299, max size: 2047
Batching took 0.370943 seconds (34.95 MB)
One electron integrals and orthogonalizer took 0.250449s
Created 2157282 / 10419984 significant shell pairs
3C integrals and B formation took 10.051806s
Iteration |      Energy      |  DIIS Metric   | Fock Time (s) | DIIS Time (s)
----------+------------------+----------------+---------------+--------------
    1     | -1701.4018593494 |   2.5284e+03   |   13.4228     |    0.1540
    2     | -1684.0208605435 |   4.4037e+00   |    2.5597     |    0.1578
    3     | -1684.6881974486 |   1.1887e+00   |    2.5398     |    0.1610
    4     | -1684.8301290640 |   2.2063e-01   |    2.5378     |    0.1641
    5     | -1684.8611276328 |   3.5115e-02   |    2.5495     |    0.1673
    6     | -1684.8664045070 |   2.0354e-03   |    2.5357     |    0.1703
    7     | -1684.8667481287 |   4.1950e-04   |    2.5361     |    0.1736
    8     | -1684.8668259118 |   6.3105e-05   |    2.5337     |    0.1765
    9     | -1684.8668382809 |   1.0117e-05   |    2.5356     |    0.1767
   10     | -1684.8668400591 |   6.2248e-07   |    2.5333     |    0.1767
   11     | -1684.8668402161 |   1.7168e-07   |    2.5366     |    0.1766
   12     | -1684.8668402588 |   3.0332e-08   |    2.5378     |    0.1767
   13     | -1684.8668402730 |   1.0005e-08   |    2.5348     |    0.1767
   14     | -1684.8668402766 |   1.3308e-09   |    2.5510     |    0.1767
   15     | -1684.8668402772 |   3.1466e-10   |    2.5374     |    0.1766
   16     | -1684.8668402773 |   7.8062e-11   |    2.5327     |    0.1767
=======================================================
         REVDSD-PBEP86-D4(NOFC) Energy Results         
=======================================================
E REVDSD-PBEP86-D4(NOFC): -1684.86684028
Nuclear Repulsion Energy: 4681.46926412
Electronic Energy:        -6288.74411603
XC Energy:                -77.591988
Converged:                1
# of SCF iterations:      16
SCF Time:                 65.51s
************************************************************
***************** Beginning RI-MP2 energy ******************
************************************************************

Created 2157282 / 10419984 significant shell pairs
=======================================================
                 RI-MP2 Energy Results                 
=======================================================
E OS:  -7.03050451091
E SS:  -2.33206564209
E MP2: -9.362570153
Time:  32.97s

=======================================================
            Individual Calculation Summary             
=======================================================
HF Energy: -1684.8668402773173511
MP2 OS Energy: -4.2035386470722145
MP2 SS Energy: -0.1331609481632506
MP2 Total Energy: -4.3366995952354648
MP2 Corrected Energy: -1689.2035398725527102
=======================================================


Topology 8 time: 99.259805 s, performance: SP: 0 FLOP/s, DP: 41.55 TFLOP/s
JSON file written to: json_logs/global_u2_r_ryans_dhdft_inputs_exess_exess_inputs_isomers_31180-31199_topology_8.json
************************************************************
**************** Running topology 10 of 20 *****************
************************************************************

************************************************************
******** Beginning RI-REVDSD-PBEP86-D4(NOFC) energy ********
************************************************************

Created 2990891 / 16064064 significant shell pairs
Created 1999581 / 10419984 significant shell pairs
Total number of grid points: 687405 (10108 per atom)
Total number of grid points: 687001 (10102 per atom)
Total number of grid points: 687018 (10103 per atom)
Octree generated 453 batches
Total number of grid points: 686456 (10094 per atom)
Octree generated 445 batches
Octree generated 452 batches
Octree generated 453 batches
Creating 445 batches. Average size: 1318, max size: 2045
Batching took 0.354745 seconds (33.69 MB)
Creating 453 batches. Average size: 1291, max size: 2046
Batching took 0.364386 seconds (34.2 MB)
Creating 452 batches. Average size: 1296, max size: 2043
Batching took 0.360499 seconds (33.86 MB)
Creating 453 batches. Average size: 1289, max size: 2034
Batching took 0.359775 seconds (33.96 MB)
One electron integrals and orthogonalizer took 0.249830s
Created 1999581 / 10419984 significant shell pairs
3C integrals and B formation took 9.020852s
Iteration |      Energy      |  DIIS Metric   | Fock Time (s) | DIIS Time (s)
----------+------------------+----------------+---------------+--------------
    1     | -1700.9353926613 |   2.4999e+03   |   13.3892     |    0.1557
    2     | -1684.0179912767 |   4.4273e+00   |    2.4949     |    0.1596
    3     | -1684.6999982980 |   1.0885e+00   |    2.4782     |    0.1627
    4     | -1684.8331301084 |   2.0517e-01   |    2.4684     |    0.1657
    5     | -1684.8612895774 |   4.1165e-02   |    2.4810     |    0.1692
    6     | -1684.8673822179 |   2.1335e-03   |    2.4746     |    0.1719
    7     | -1684.8677298824 |   5.3373e-04   |    2.4701     |    0.1751
    8     | -1684.8678190772 |   4.8006e-05   |    2.4722     |    0.1782
    9     | -1684.8678293554 |   9.8648e-06   |    2.4741     |    0.1783
   10     | -1684.8678309570 |   7.4148e-07   |    2.4767     |    0.1783
   11     | -1684.8678310815 |   1.5389e-07   |    2.4699     |    0.1784
   12     | -1684.8678311086 |   1.3930e-08   |    2.4732     |    0.1783
   13     | -1684.8678311129 |   4.1862e-09   |    2.4722     |    0.1782
   14     | -1684.8678311142 |   7.6782e-10   |    2.4696     |    0.1783
   15     | -1684.8678311144 |   2.1994e-10   |    2.4717     |    0.1784
   16     | -1684.8678311145 |   5.4135e-11   |    2.4753     |    0.1782
=======================================================
         REVDSD-PBEP86-D4(NOFC) Energy Results         
=======================================================
E REVDSD-PBEP86-D4(NOFC): -1684.86783111
Nuclear Repulsion Energy: 4524.32732362
Electronic Energy:        -6131.60487727
XC Energy:                -77.590277
Converged:                1
# of SCF iterations:      16
SCF Time:                 63.47s
************************************************************
***************** Beginning RI-MP2 energy ******************
************************************************************

Created 1999581 / 10419984 significant shell pairs
=======================================================
                 RI-MP2 Energy Results                 
=======================================================
E OS:  -7.02385169519
E SS:  -2.32732589153
E MP2: -9.35117758672
Time:  32.347s

=======================================================
            Individual Calculation Summary             
=======================================================
HF Energy: -1684.8678311144954023
MP2 OS Energy: -4.1995609285519420
MP2 SS Energy: -0.1328903084065143
MP2 Total Energy: -4.3324512369584562
MP2 Corrected Energy: -1689.2002823514537795
=======================================================


Topology 9 time: 96.568060 s, performance: SP: 0 FLOP/s, DP: 42.19 TFLOP/s
JSON file written to: json_logs/global_u2_r_ryans_dhdft_inputs_exess_exess_inputs_isomers_31180-31199_topology_9.json
************************************************************
**************** Running topology 11 of 20 *****************
************************************************************

************************************************************
******** Beginning RI-REVDSD-PBEP86-D4(NOFC) energy ********
************************************************************

Created 3002087 / 16064064 significant shell pairs
Created 2007635 / 10419984 significant shell pairs
Total number of grid points: 687158 (10105 per atom)
Total number of grid points: 686459 (10094 per atom)
Total number of grid points: 686638 (10097 per atom)
Octree generated 435 batches
Total number of grid points: 687625 (10112 per atom)
Octree generated 448 batches
Octree generated 440 batches
Octree generated 455 batches
Creating 435 batches. Average size: 1341, max size: 2033
Batching took 0.346206 seconds (32.77 MB)
Creating 448 batches. Average size: 1306, max size: 2048
Batching took 0.364394 seconds (33.81 MB)
Creating 440 batches. Average size: 1331, max size: 2033
Batching took 0.356572 seconds (33.19 MB)
Creating 455 batches. Average size: 1290, max size: 2041
Batching took 0.363509 seconds (34.24 MB)
One electron integrals and orthogonalizer took 0.253114s
Created 2007635 / 10419984 significant shell pairs
3C integrals and B formation took 9.224439s
Iteration |      Energy      |  DIIS Metric   | Fock Time (s) | DIIS Time (s)
----------+------------------+----------------+---------------+--------------
    1     | -1700.5605221070 |   2.4849e+03   |   13.3722     |    0.1542
    2     | -1684.0102293473 |   4.5854e+00   |    2.4718     |    0.1579
    3     | -1684.6787127074 |   1.2642e+00   |    2.4743     |    0.1610
    4     | -1684.8292569816 |   2.5396e-01   |    2.4706     |    0.1642
    5     | -1684.8637716653 |   4.8097e-02   |    2.4732     |    0.1671
    6     | -1684.8708194303 |   2.8299e-03   |    2.4699     |    0.1704
    7     | -1684.8712440440 |   5.3909e-04   |    2.4702     |    0.1736
    8     | -1684.8713374489 |   5.7202e-05   |    2.4671     |    0.1766
    9     | -1684.8713488038 |   1.7076e-05   |    2.4669     |    0.1767
   10     | -1684.8713517468 |   9.9359e-07   |    2.4707     |    0.1767
   11     | -1684.8713519257 |   2.1138e-07   |    2.4663     |    0.1768
   12     | -1684.8713519650 |   2.2400e-08   |    2.4651     |    0.1765
   13     | -1684.8713519719 |   6.2874e-09   |    2.4716     |    0.1767
   14     | -1684.8713519741 |   1.5746e-09   |    2.4727     |    0.1767
   15     | -1684.8713519748 |   4.3533e-10   |    2.4736     |    0.1766
   16     | -1684.8713519749 |   1.1517e-10   |    2.4730     |    0.1769
   17     | -1684.8713519750 |   2.8320e-11   |    2.4733     |    0.1767
=======================================================
         REVDSD-PBEP86-D4(NOFC) Energy Results         
=======================================================
E REVDSD-PBEP86-D4(NOFC): -1684.87135197
Nuclear Repulsion Energy: 4536.94738023
Electronic Energy:        -6144.22831772
XC Energy:                -77.590414
Converged:                1
# of SCF iterations:      17
SCF Time:                 66.247s
************************************************************
***************** Beginning RI-MP2 energy ******************
************************************************************

Created 2007635 / 10419984 significant shell pairs
=======================================================
                 RI-MP2 Energy Results                 
=======================================================
E OS:  -7.02339342284
E SS:  -2.32751092335
E MP2: -9.35090434619
Time:  32.563s

=======================================================
            Individual Calculation Summary             
=======================================================
HF Energy: -1684.8713519749605894
MP2 OS Energy: -4.1992869275143878
MP2 SS Energy: -0.1329008737232359
MP2 Total Energy: -4.3321878012376240
MP2 Corrected Energy: -1689.2035397761981130
=======================================================


Topology 10 time: 99.552177 s, performance: SP: 0 FLOP/s, DP: 41.45 TFLOP/s
JSON file written to: json_logs/global_u2_r_ryans_dhdft_inputs_exess_exess_inputs_isomers_31180-31199_topology_10.json
************************************************************
**************** Running topology 12 of 20 *****************
************************************************************

************************************************************
******** Beginning RI-REVDSD-PBEP86-D4(NOFC) energy ********
************************************************************

Created 3032283 / 16064064 significant shell pairs
Created 2030533 / 10419984 significant shell pairs
Total number of grid points: 687331 (10107 per atom)
Total number of grid points: 687109 (10104 per atom)
Total number of grid points: 687260 (10106 per atom)
Octree generated 445 batches
Octree generated 450 batches
Octree generated 446 batches
Total number of grid points: 686180 (10090 per atom)
Octree generated 445 batches
Creating 445 batches. Average size: 1313, max size: 2039
Batching took 0.360046 seconds (33.87 MB)
Creating 450 batches. Average size: 1306, max size: 2048
Batching took 0.366587 seconds (34.21 MB)
Creating 446 batches. Average size: 1305, max size: 2048
Batching took 0.365163 seconds (33.94 MB)
Creating 445 batches. Average size: 1310, max size: 2045
Batching took 0.358879 seconds (33.85 MB)
One electron integrals and orthogonalizer took 0.261764s
Created 2030533 / 10419984 significant shell pairs
3C integrals and B formation took 9.916903s
Iteration |      Energy      |  DIIS Metric   | Fock Time (s) | DIIS Time (s)
----------+------------------+----------------+---------------+--------------
    1     | -1702.8840246560 |   2.5741e+03   |   13.4063     |    0.1557
    2     | -1683.9980341355 |   4.3377e+00   |    2.4992     |    0.1595
    3     | -1684.6761542300 |   1.2389e+00   |    2.4726     |    0.1628
    4     | -1684.8255443432 |   2.5095e-01   |    2.4747     |    0.1657
    5     | -1684.8612294709 |   4.9642e-02   |    2.4700     |    0.1690
    6     | -1684.8688678757 |   2.9864e-03   |    2.4781     |    0.1720
    7     | -1684.8693753263 |   6.6466e-04   |    2.4852     |    0.1752
    8     | -1684.8694968048 |   6.9279e-05   |    2.4912     |    0.1783
    9     | -1684.8695099927 |   1.3175e-05   |    2.4916     |    0.1782
   10     | -1684.8695121429 |   8.8822e-07   |    2.4974     |    0.1783
   11     | -1684.8695123454 |   2.5966e-07   |    2.4810     |    0.1783
   12     | -1684.8695124077 |   4.0730e-08   |    2.4744     |    0.1784
   13     | -1684.8695124273 |   1.3670e-08   |    2.4728     |    0.1782
   14     | -1684.8695124325 |   2.0706e-09   |    2.4705     |    0.1783
   15     | -1684.8695124334 |   6.3580e-10   |    2.4684     |    0.1783
   16     | -1684.8695124336 |   1.3656e-10   |    2.4751     |    0.1783
   17     | -1684.8695124336 |   2.8474e-11   |    2.4724     |    0.1784
=======================================================
         REVDSD-PBEP86-D4(NOFC) Energy Results         
=======================================================
E REVDSD-PBEP86-D4(NOFC): -1684.86951243
Nuclear Repulsion Energy: 4548.45853812
Electronic Energy:        -6155.7394968
XC Energy:                -77.588554
Converged:                1
# of SCF iterations:      17
SCF Time:                 67.172s
************************************************************
***************** Beginning RI-MP2 energy ******************
************************************************************

Created 2030533 / 10419984 significant shell pairs
=======================================================
                 RI-MP2 Energy Results                 
=======================================================
E OS:  -7.02448386601
E SS:  -2.32708861741
E MP2: -9.35157248342
Time:  32.52s

=======================================================
            Individual Calculation Summary             
=======================================================
HF Energy: -1684.8695124336190929
MP2 OS Energy: -4.1999389034848482
MP2 SS Energy: -0.1328767600542885
MP2 Total Energy: -4.3328156635391366
MP2 Corrected Energy: -1689.2023280971582153
=======================================================


Topology 11 time: 100.446634 s, performance: SP: 0 FLOP/s, DP: 41.16 TFLOP/s
JSON file written to: json_logs/global_u2_r_ryans_dhdft_inputs_exess_exess_inputs_isomers_31180-31199_topology_11.json
************************************************************
**************** Running topology 13 of 20 *****************
************************************************************

************************************************************
******** Beginning RI-REVDSD-PBEP86-D4(NOFC) energy ********
************************************************************

Created 3063897 / 16064064 significant shell pairs
Created 2053696 / 10419984 significant shell pairs
Total number of grid points: 687297 (10107 per atom)
Total number of grid points: 687133 (10104 per atom)
Total number of grid points: 686844 (10100 per atom)
Total number of grid points: 686606 (10097 per atom)
Octree generated 443 batches
Octree generated 453 batches
Octree generated 442 batches
Octree generated 445 batches
Creating 443 batches. Average size: 1321, max size: 2040
Batching took 0.357040 seconds (33.71 MB)
Creating 453 batches. Average size: 1294, max size: 2039
Batching took 0.367572 seconds (34.59 MB)
Creating 442 batches. Average size: 1318, max size: 2040
Batching took 0.364092 seconds (33.64 MB)
Creating 445 batches. Average size: 1311, max size: 2048
Batching took 0.361385 seconds (33.84 MB)
One electron integrals and orthogonalizer took 0.254340s
Created 2053696 / 10419984 significant shell pairs
3C integrals and B formation took 9.902273s
Iteration |      Energy      |  DIIS Metric   | Fock Time (s) | DIIS Time (s)
----------+------------------+----------------+---------------+--------------
    1     | -1701.3426828302 |   2.5111e+03   |   13.4075     |    0.1543
    2     | -1684.0117394360 |   4.4009e+00   |    2.4979     |    0.1580
    3     | -1684.6929719760 |   1.1401e+00   |    2.5010     |    0.1612
    4     | -1684.8302866592 |   2.4923e-01   |    2.4973     |    0.1643
    5     | -1684.8645560928 |   5.4328e-02   |    2.5048     |    0.1674
    6     | -1684.8728059924 |   2.8140e-03   |    2.4941     |    0.1706
    7     | -1684.8732694613 |   6.0156e-04   |    2.4974     |    0.1736
    8     | -1684.8733775970 |   5.1689e-05   |    2.4970     |    0.1767
    9     | -1684.8733888033 |   1.1664e-05   |    2.4938     |    0.1768
   10     | -1684.8733906831 |   8.3506e-07   |    2.4972     |    0.1768
   11     | -1684.8733908367 |   2.0567e-07   |    2.4943     |    0.1769
   12     | -1684.8733908756 |   2.3909e-08   |    2.4956     |    0.1767
   13     | -1684.8733908832 |   7.3950e-09   |    2.5036     |    0.1767
   14     | -1684.8733908855 |   1.4122e-09   |    2.4943     |    0.1768
   15     | -1684.8733908860 |   3.7342e-10   |    2.4969     |    0.1767
   16     | -1684.8733908861 |   9.6211e-11   |    2.4982     |    0.1768
=======================================================
         REVDSD-PBEP86-D4(NOFC) Energy Results         
=======================================================
E REVDSD-PBEP86-D4(NOFC): -1684.87339089
Nuclear Repulsion Energy: 4589.98342764
Electronic Energy:        -6197.26667505
XC Energy:                -77.590143
Converged:                1
# of SCF iterations:      16
SCF Time:                 64.723s
************************************************************
***************** Beginning RI-MP2 energy ******************
************************************************************

Created 2053696 / 10419984 significant shell pairs
